Sno,Date,Province/State,Country,Last Update,Confirmed,Deaths,Recovered
1,01/22/2020 12:00:00,Anhui,China,01/22/2020 12:00:00,1.0,0.0,0.0
2,01/22/2020 12:00:00,Beijing,China,01/22/2020 12:00:00,14.0,0.0,0.0
3,01/22/2020 12:00:00,Chongqing,China,01/22/2020 12:00:00,6.0,0.0,0.0
4,01/22/2020 12:00:00,Fujian,China,01/22/2020 12:00:00,1.0,0.0,0.0
5,01/22/2020 12:00:00,Gansu,China,01/22/2020 12:00:00,0.0,0.0,0.0
6,01/22/2020 12:00:00,Guangdong,China,01/22/2020 12:00:00,26.0,0.0,0.0
7,01/22/2020 12:00:00,Guangxi,China,01/22/2020 12:00:00,2.0,0.0,0.0
8,01/22/2020 12:00:00,Guizhou,China,01/22/2020 12:00:00,1.0,0.0,0.0
9,01/22/2020 12:00:00,Hainan,China,01/22/2020 12:00:00,4.0,0.0,0.0
10,01/22/2020 12:00:00,Hebei,China,01/22/2020 12:00:00,1.0,0.0,0.0
11,01/22/2020 12:00:00,Heilongjiang,China,01/22/2020 12:00:00,0.0,0.0,0.0
12,01/22/2020 12:00:00,Henan,China,01/22/2020 12:00:00,5.0,0.0,0.0
13,01/22/2020 12:00:00,Hong Kong,China,01/22/2020 12:00:00,0.0,0.0,0.0
14,01/22/2020 12:00:00,Hubei,China,01/22/2020 12:00:00,444.0,0.0,0.0
15,01/22/2020 12:00:00,Hunan,China,01/22/2020 12:00:00,4.0,0.0,0.0
16,01/22/2020 12:00:00,Inner Mongolia,China,01/22/2020 12:00:00,0.0,0.0,0.0
17,01/22/2020 12:00:00,Jiangsu,China,01/22/2020 12:00:00,1.0,0.0,0.0
18,01/22/2020 12:00:00,Jiangxi,China,01/22/2020 12:00:00,2.0,0.0,0.0
19,01/22/2020 12:00:00,Jilin,China,01/22/2020 12:00:00,0.0,0.0,0.0
20,01/22/2020 12:00:00,Liaoning,China,01/22/2020 12:00:00,2.0,0.0,0.0
21,01/22/2020 12:00:00,Macau,China,01/22/2020 12:00:00,1.0,0.0,0.0
22,01/22/2020 12:00:00,Ningxia,China,01/22/2020 12:00:00,1.0,0.0,0.0
23,01/22/2020 12:00:00,Qinghai,China,01/22/2020 12:00:00,0.0,0.0,0.0
24,01/22/2020 12:00:00,Shaanxi,China,01/22/2020 12:00:00,0.0,0.0,0.0
25,01/22/2020 12:00:00,Shandong,China,01/22/2020 12:00:00,2.0,0.0,0.0
26,01/22/2020 12:00:00,Shanghai,China,01/22/2020 12:00:00,9.0,0.0,0.0
27,01/22/2020 12:00:00,Shanxi,China,01/22/2020 12:00:00,1.0,0.0,0.0
28,01/22/2020 12:00:00,Sichuan,China,01/22/2020 12:00:00,5.0,0.0,0.0
29,01/22/2020 12:00:00,Taiwan,China,01/22/2020 12:00:00,1.0,0.0,0.0
30,01/22/2020 12:00:00,Tianjin,China,01/22/2020 12:00:00,4.0,0.0,0.0
31,01/22/2020 12:00:00,Tibet,China,01/22/2020 12:00:00,0.0,0.0,0.0
32,01/22/2020 12:00:00,Washington,US,01/22/2020 12:00:00,1.0,0.0,0.0
33,01/22/2020 12:00:00,Xinjiang,China,01/22/2020 12:00:00,0.0,0.0,0.0
34,01/22/2020 12:00:00,Yunnan,China,01/22/2020 12:00:00,1.0,0.0,0.0
35,01/22/2020 12:00:00,Zhejiang,China,01/22/2020 12:00:00,10.0,0.0,0.0
36,01/22/2020 12:00:00,,Japan,01/22/2020 12:00:00,2.0,0.0,0.0
37,01/22/2020 12:00:00,,Thailand,01/22/2020 12:00:00,2.0,0.0,0.0
38,01/22/2020 12:00:00,,South Korea,01/22/2020 12:00:00,1.0,0.0,0.0
39,01/23/2020 12:00:00,Anhui,Mainland China,01/23/2020 12:00:00,9.0,0.0,0.0
40,01/23/2020 12:00:00,Beijing,Mainland China,01/23/2020 12:00:00,22.0,0.0,0.0
41,01/23/2020 12:00:00,Chongqing,Mainland China,01/23/2020 12:00:00,9.0,0.0,0.0
42,01/23/2020 12:00:00,Fujian,Mainland China,01/23/2020 12:00:00,5.0,0.0,0.0
43,01/23/2020 12:00:00,Gansu,Mainland China,01/23/2020 12:00:00,2.0,0.0,0.0
44,01/23/2020 12:00:00,Guangdong,Mainland China,01/23/2020 12:00:00,32.0,0.0,2.0
45,01/23/2020 12:00:00,Guangxi,Mainland China,01/23/2020 12:00:00,5.0,0.0,0.0
46,01/23/2020 12:00:00,Guizhou,Mainland China,01/23/2020 12:00:00,3.0,0.0,0.0
47,01/23/2020 12:00:00,Hainan,Mainland China,01/23/2020 12:00:00,5.0,0.0,0.0
48,01/23/2020 12:00:00,Hebei,Mainland China,01/23/2020 12:00:00,1.0,1.0,0.0
49,01/23/2020 12:00:00,Heilongjiang,Mainland China,01/23/2020 12:00:00,2.0,0.0,0.0
50,01/23/2020 12:00:00,Henan,Mainland China,01/23/2020 12:00:00,5.0,0.0,0.0
51,01/23/2020 12:00:00,Hong Kong,Hong Kong,01/23/2020 12:00:00,2.0,0.0,0.0
52,01/23/2020 12:00:00,Hubei,Mainland China,01/23/2020 12:00:00,444.0,17.0,28.0
53,01/23/2020 12:00:00,Hunan,Mainland China,01/23/2020 12:00:00,9.0,0.0,0.0
54,01/23/2020 12:00:00,Inner Mongolia,Mainland China,01/23/2020 12:00:00,0.0,0.0,0.0
55,01/23/2020 12:00:00,Jiangsu,Mainland China,01/23/2020 12:00:00,5.0,0.0,0.0
56,01/23/2020 12:00:00,Jiangxi,Mainland China,01/23/2020 12:00:00,7.0,0.0,0.0
57,01/23/2020 12:00:00,Jilin,Mainland China,01/23/2020 12:00:00,1.0,0.0,0.0
58,01/23/2020 12:00:00,Liaoning,Mainland China,01/23/2020 12:00:00,3.0,0.0,0.0
59,01/23/2020 12:00:00,Macau,Macau,01/23/2020 12:00:00,2.0,0.0,0.0
60,01/23/2020 12:00:00,Ningxia,Mainland China,01/23/2020 12:00:00,1.0,0.0,0.0
61,01/23/2020 12:00:00,Qinghai,Mainland China,01/23/2020 12:00:00,0.0,0.0,0.0
62,01/23/2020 12:00:00,Shaanxi,Mainland China,01/23/2020 12:00:00,3.0,0.0,0.0
63,01/23/2020 12:00:00,Shandong,Mainland China,01/23/2020 12:00:00,6.0,0.0,0.0
64,01/23/2020 12:00:00,Shanghai,Mainland China,01/23/2020 12:00:00,16.0,0.0,0.0
65,01/23/2020 12:00:00,Shanxi,Mainland China,01/23/2020 12:00:00,1.0,0.0,0.0
66,01/23/2020 12:00:00,Sichuan,Mainland China,01/23/2020 12:00:00,8.0,0.0,0.0
67,01/23/2020 12:00:00,Taiwan,Taiwan,01/23/2020 12:00:00,1.0,0.0,0.0
68,01/23/2020 12:00:00,Tianjin,Mainland China,01/23/2020 12:00:00,4.0,0.0,0.0
69,01/23/2020 12:00:00,Tibet,Mainland China,01/23/2020 12:00:00,0.0,0.0,0.0
70,01/23/2020 12:00:00,Washington,US,01/23/2020 12:00:00,1.0,0.0,0.0
71,01/23/2020 12:00:00,Xinjiang,Mainland China,01/23/2020 12:00:00,2.0,0.0,0.0
72,01/23/2020 12:00:00,Yunnan,Mainland China,01/23/2020 12:00:00,2.0,0.0,0.0
73,01/23/2020 12:00:00,Zhejiang,Mainland China,01/23/2020 12:00:00,27.0,0.0,0.0
74,01/23/2020 12:00:00,,Japan,01/23/2020 12:00:00,1.0,0.0,0.0
75,01/23/2020 12:00:00,,Thailand,01/23/2020 12:00:00,3.0,0.0,0.0
76,01/23/2020 12:00:00,,South Korea,01/23/2020 12:00:00,1.0,0.0,0.0
77,01/23/2020 12:00:00,,Singapore,01/23/2020 12:00:00,1.0,0.0,0.0
78,01/23/2020 12:00:00,,Philippines,01/23/2020 12:00:00,0.0,0.0,0.0
79,01/23/2020 12:00:00,,Malaysia,01/23/2020 12:00:00,0.0,0.0,0.0
80,01/23/2020 12:00:00,,Vietnam,01/23/2020 12:00:00,2.0,0.0,0.0
81,01/23/2020 12:00:00,,Australia,01/23/2020 12:00:00,0.0,0.0,0.0
82,01/23/2020 12:00:00,,Mexico,01/23/2020 12:00:00,0.0,0.0,0.0
83,01/23/2020 12:00:00,,Brazil,01/23/2020 12:00:00,0.0,0.0,0.0
84,01/24/2020 12:00:00,Hubei,Mainland China,01/24/2020 12:00:00,549.0,24.0,31.0
85,01/24/2020 12:00:00,Guangdong,Mainland China,01/24/2020 12:00:00,53.0,0.0,2.0
86,01/24/2020 12:00:00,Zhejiang,Mainland China,01/24/2020 12:00:00,43.0,0.0,1.0
87,01/24/2020 12:00:00,Beijing,Mainland China,01/24/2020 12:00:00,36.0,0.0,1.0
88,01/24/2020 12:00:00,Chongqing,Mainland China,01/24/2020 12:00:00,27.0,0.0,0.0
89,01/24/2020 12:00:00,Hunan,Mainland China,01/24/2020 12:00:00,24.0,0.0,0.0
90,01/24/2020 12:00:00,Guangxi,Mainland China,01/24/2020 12:00:00,23.0,0.0,0.0
91,01/24/2020 12:00:00,Shanghai,Mainland China,01/24/2020 12:00:00,20.0,0.0,1.0
92,01/24/2020 12:00:00,Jiangxi,Mainland China,01/24/2020 12:00:00,18.0,0.0,0.0
93,01/24/2020 12:00:00,Sichuan,Mainland China,01/24/2020 12:00:00,15.0,0.0,0.0
94,01/24/2020 12:00:00,Shandong,Mainland China,01/24/2020 12:00:00,15.0,0.0,0.0
95,01/24/2020 12:00:00,Anhui,Mainland China,01/24/2020 12:00:00,15.0,0.0,0.0
96,01/24/2020 12:00:00,Fujian,Mainland China,01/24/2020 12:00:00,10.0,0.0,0.0
97,01/24/2020 12:00:00,Henan,Mainland China,01/24/2020 12:00:00,9.0,0.0,0.0
98,01/24/2020 12:00:00,Jiangsu,Mainland China,01/24/2020 12:00:00,9.0,0.0,0.0
99,01/24/2020 12:00:00,Hainan,Mainland China,01/24/2020 12:00:00,8.0,0.0,0.0
100,01/24/2020 12:00:00,Tianjin,Mainland China,01/24/2020 12:00:00,8.0,0.0,0.0
101,01/24/2020 12:00:00,Yunnan,Mainland China,01/24/2020 12:00:00,5.0,0.0,0.0
102,01/24/2020 12:00:00,Shaanxi,Mainland China,01/24/2020 12:00:00,5.0,0.0,0.0
103,01/24/2020 12:00:00,Heilongjiang,Mainland China,01/24/2020 12:00:00,4.0,1.0,0.0
104,01/24/2020 12:00:00,Liaoning,Mainland China,01/24/2020 12:00:00,4.0,0.0,0.0
105,01/24/2020 12:00:00,Guizhou,Mainland China,01/24/2020 12:00:00,3.0,0.0,0.0
106,01/24/2020 12:00:00,Jilin,Mainland China,01/24/2020 12:00:00,3.0,0.0,0.0
107,01/24/2020 12:00:00,Taiwan,Taiwan,01/24/2020 12:00:00,3.0,0.0,0.0
108,01/24/2020 12:00:00,Ningxia,Mainland China,01/24/2020 12:00:00,2.0,0.0,0.0
109,01/24/2020 12:00:00,Hong Kong,Hong Kong,01/24/2020 12:00:00,2.0,0.0,0.0
110,01/24/2020 12:00:00,Macau,Macau,01/24/2020 12:00:00,2.0,0.0,0.0
111,01/24/2020 12:00:00,Hebei,Mainland China,01/24/2020 12:00:00,2.0,1.0,0.0
112,01/24/2020 12:00:00,Gansu,Mainland China,01/24/2020 12:00:00,2.0,0.0,0.0
113,01/24/2020 12:00:00,Xinjiang,Mainland China,01/24/2020 12:00:00,2.0,0.0,0.0
114,01/24/2020 12:00:00,Shanxi,Mainland China,01/24/2020 12:00:00,1.0,0.0,0.0
115,01/24/2020 12:00:00,Inner Mongolia,Mainland China,01/24/2020 12:00:00,1.0,0.0,0.0
116,01/24/2020 12:00:00,Qinghai,Mainland China,01/24/2020 12:00:00,0.0,0.0,0.0
117,01/24/2020 12:00:00,Washington,US,01/24/2020 12:00:00,1.0,0.0,0.0
118,01/24/2020 12:00:00,Chicago,US,01/24/2020 12:00:00,1.0,0.0,0.0
119,01/24/2020 12:00:00,,Japan,01/24/2020 12:00:00,2.0,0.0,0.0
120,01/24/2020 12:00:00,,Thailand,01/24/2020 12:00:00,5.0,0.0,0.0
121,01/24/2020 12:00:00,,South Korea,01/24/2020 12:00:00,2.0,0.0,0.0
122,01/24/2020 12:00:00,,Singapore,01/24/2020 12:00:00,3.0,0.0,0.0
123,01/24/2020 12:00:00,,Vietnam,01/24/2020 12:00:00,2.0,0.0,0.0
124,01/24/2020 12:00:00,,France,01/24/2020 16:00:00,2.0,0.0,0.0
125,01/25/2020 22:00:00,Hubei,Mainland China,01/25/2020 22:00:00,1052.0,52.0,42.0
126,01/25/2020 22:00:00,Zhejiang,Mainland China,01/25/2020 22:00:00,104.0,0.0,1.0
127,01/25/2020 22:00:00,Guangdong,Mainland China,01/25/2020 12:00:00,98.0,0.0,2.0
128,01/25/2020 22:00:00,Henan,Mainland China,01/25/2020 12:00:00,83.0,1.0,0.0
129,01/25/2020 22:00:00,Chongqing,Mainland China,01/25/2020 12:00:00,75.0,0.0,0.0
130,01/25/2020 22:00:00,Hunan,Mainland China,01/25/2020 12:00:00,69.0,0.0,0.0
131,01/25/2020 22:00:00,Anhui,Mainland China,01/25/2020 12:00:00,60.0,0.0,0.0
132,01/25/2020 22:00:00,Beijing,Mainland China,01/25/2020 12:00:00,51.0,0.0,2.0
133,01/25/2020 22:00:00,Sichuan,Mainland China,01/25/2020 12:00:00,44.0,0.0,0.0
134,01/25/2020 22:00:00,Shanghai,Mainland China,01/25/2020 12:00:00,40.0,1.0,1.0
135,01/25/2020 22:00:00,Shandong,Mainland China,01/25/2020 12:00:00,39.0,0.0,0.0
136,01/25/2020 22:00:00,Jiangxi,Mainland China,01/25/2020 12:00:00,36.0,0.0,0.0
137,01/25/2020 22:00:00,Guangxi,Mainland China,01/25/2020 12:00:00,33.0,0.0,0.0
138,01/25/2020 22:00:00,Jiangsu,Mainland China,01/25/2020 12:00:00,31.0,0.0,1.0
139,01/25/2020 22:00:00,Hainan,Mainland China,01/25/2020 12:00:00,19.0,0.0,0.0
140,01/25/2020 22:00:00,Liaoning,Mainland China,01/25/2020 12:00:00,19.0,0.0,0.0
141,01/25/2020 22:00:00,Fujian,Mainland China,01/25/2020 12:00:00,18.0,1.0,0.0
142,01/25/2020 22:00:00,Heilongjiang,Mainland China,01/25/2020 12:00:00,15.0,0.0,0.0
143,01/25/2020 22:00:00,Shaanxi,Mainland China,01/25/2020 12:00:00,15.0,0.0,0.0
144,01/25/2020 22:00:00,Tianjin,Mainland China,01/25/2020 12:00:00,13.0,0.0,0.0
145,01/25/2020 22:00:00,Hebei,Mainland China,01/25/2020 12:00:00,13.0,1.0,0.0
146,01/25/2020 22:00:00,Yunnan,Mainland China,01/25/2020 12:00:00,11.0,0.0,0.0
147,01/25/2020 22:00:00,Shanxi,Mainland China,01/25/2020 12:00:00,9.0,0.0,0.0
148,01/25/2020 22:00:00,Inner Mongolia,Mainland China,01/25/2020 12:00:00,7.0,0.0,0.0
149,01/25/2020 22:00:00,Gansu,Mainland China,01/25/2020 12:00:00,7.0,0.0,0.0
150,01/25/2020 22:00:00,Guizhou,Mainland China,01/25/2020 12:00:00,5.0,0.0,0.0
151,01/25/2020 22:00:00,Hong Kong,Hong Kong,01/25/2020 12:00:00,5.0,0.0,0.0
152,01/25/2020 22:00:00,Ningxia,Mainland China,01/25/2020 12:00:00,4.0,0.0,0.0
153,01/25/2020 22:00:00,Jilin,Mainland China,01/25/2020 12:00:00,4.0,0.0,0.0
154,01/25/2020 22:00:00,Xinjiang,Mainland China,01/25/2020 12:00:00,4.0,0.0,0.0
155,01/25/2020 22:00:00,Taiwan,Taiwan,01/25/2020 12:00:00,3.0,0.0,0.0
156,01/25/2020 22:00:00,Macau,Macau,01/25/2020 12:00:00,2.0,0.0,0.0
157,01/25/2020 22:00:00,Qinghai,Mainland China,01/25/2020 12:00:00,1.0,0.0,0.0
158,01/25/2020 22:00:00,Washington,US,01/25/2020 12:00:00,1.0,0.0,0.0
159,01/25/2020 22:00:00,Illinois,US,01/25/2020 12:00:00,1.0,0.0,0.0
160,01/25/2020 22:00:00,,Japan,01/25/2020 12:00:00,2.0,0.0,0.0
161,01/25/2020 22:00:00,,Thailand,01/25/2020 12:00:00,7.0,0.0,0.0
162,01/25/2020 22:00:00,,South Korea,01/25/2020 12:00:00,3.0,0.0,0.0
163,01/25/2020 22:00:00,,Singapore,01/25/2020 12:00:00,3.0,0.0,0.0
164,01/25/2020 22:00:00,,Vietnam,01/25/2020 12:00:00,2.0,0.0,0.0
165,01/25/2020 22:00:00,,France,01/25/2020 12:00:00,3.0,0.0,0.0
166,01/25/2020 22:00:00,,Australia,01/25/2020 12:00:00,4.0,0.0,0.0
167,01/25/2020 22:00:00,,Nepal,01/25/2020 12:00:00,1.0,0.0,0.0
168,01/25/2020 22:00:00,,Malaysia,01/25/2020 12:00:00,3.0,0.0,0.0
169,01/26/2020 23:00:00,Hubei,Mainland China,01/26/2020 23:00:00,1423.0,76.0,44.0
170,01/26/2020 23:00:00,Guangdong,Mainland China,01/26/2020 23:00:00,146.0,0.0,2.0
171,01/26/2020 23:00:00,Zhejiang,Mainland China,01/26/2020 23:00:00,128.0,0.0,1.0
172,01/26/2020 23:00:00,Henan,Mainland China,01/26/2020 23:00:00,128.0,1.0,0.0
173,01/26/2020 23:00:00,Chongqing,Mainland China,01/26/2020 23:00:00,110.0,0.0,0.0
174,01/26/2020 23:00:00,Hunan,Mainland China,01/26/2020 23:00:00,100.0,0.0,0.0
175,01/26/2020 23:00:00,Anhui,Mainland China,01/26/2020 23:00:00,70.0,0.0,0.0
176,01/26/2020 23:00:00,Sichuan,Mainland China,01/26/2020 23:00:00,69.0,0.0,0.0
177,01/26/2020 23:00:00,Beijing,Mainland China,01/26/2020 23:00:00,68.0,0.0,2.0
178,01/26/2020 23:00:00,Shandong,Mainland China,01/26/2020 23:00:00,63.0,0.0,0.0
179,01/26/2020 23:00:00,Shanghai,Mainland China,01/26/2020 23:00:00,53.0,1.0,1.0
180,01/26/2020 23:00:00,Jiangxi,Mainland China,01/26/2020 23:00:00,48.0,0.0,0.0
181,01/26/2020 23:00:00,Jiangsu,Mainland China,01/26/2020 23:00:00,47.0,0.0,1.0
182,01/26/2020 23:00:00,Guangxi,Mainland China,01/26/2020 23:00:00,46.0,0.0,0.0
183,01/26/2020 23:00:00,Fujian,Mainland China,01/26/2020 23:00:00,35.0,0.0,0.0
184,01/26/2020 23:00:00,Liaoning,Mainland China,01/26/2020 23:00:00,23.0,0.0,0.0
185,01/26/2020 23:00:00,Hainan,Mainland China,01/26/2020 23:00:00,22.0,0.0,0.0
186,01/26/2020 23:00:00,Shaanxi,Mainland China,01/26/2020 23:00:00,22.0,0.0,0.0
187,01/26/2020 23:00:00,Heilongjiang,Mainland China,01/26/2020 23:00:00,21.0,1.0,0.0
188,01/26/2020 23:00:00,Yunnan,Mainland China,01/26/2020 23:00:00,19.0,0.0,0.0
189,01/26/2020 23:00:00,Hebei,Mainland China,01/26/2020 23:00:00,18.0,1.0,0.0
190,01/26/2020 23:00:00,Tianjin,Mainland China,01/26/2020 23:00:00,14.0,0.0,0.0
191,01/26/2020 23:00:00,Gansu,Mainland China,01/26/2020 23:00:00,14.0,0.0,0.0
192,01/26/2020 23:00:00,Shanxi,Mainland China,01/26/2020 23:00:00,13.0,0.0,0.0
193,01/26/2020 23:00:00,Inner Mongolia,Mainland China,01/26/2020 23:00:00,11.0,0.0,0.0
194,01/26/2020 23:00:00,Hong Kong,Hong Kong,01/26/2020 23:00:00,8.0,0.0,0.0
195,01/26/2020 23:00:00,Guizhou,Mainland China,01/26/2020 23:00:00,7.0,0.0,0.0
196,01/26/2020 23:00:00,Jilin,Mainland China,01/26/2020 23:00:00,6.0,0.0,0.0
197,01/26/2020 23:00:00,Macau,Macau,01/26/2020 23:00:00,6.0,0.0,0.0
198,01/26/2020 23:00:00,Xinjiang,Mainland China,01/26/2020 23:00:00,5.0,0.0,0.0
199,01/26/2020 23:00:00,Ningxia,Mainland China,01/26/2020 23:00:00,4.0,0.0,0.0
200,01/26/2020 23:00:00,Taiwan,Taiwan,01/26/2020 23:00:00,4.0,0.0,0.0
201,01/26/2020 23:00:00,Qinghai,Mainland China,01/26/2020 23:00:00,4.0,0.0,0.0
202,01/26/2020 23:00:00,Washington,US,01/26/2020 23:00:00,1.0,0.0,0.0
203,01/26/2020 23:00:00,Illinois,US,01/26/2020 23:00:00,1.0,0.0,0.0
204,01/26/2020 23:00:00,California,US,01/26/2020 23:00:00,2.0,0.0,0.0
205,01/26/2020 23:00:00,Arizona,US,01/26/2020 23:00:00,1.0,0.0,0.0
206,01/26/2020 23:00:00,,Japan,01/26/2020 23:00:00,4.0,0.0,1.0
207,01/26/2020 23:00:00,,Thailand,01/26/2020 23:00:00,8.0,0.0,2.0
208,01/26/2020 23:00:00,,South Korea,01/26/2020 23:00:00,3.0,0.0,0.0
209,01/26/2020 23:00:00,,Singapore,01/26/2020 23:00:00,4.0,0.0,0.0
210,01/26/2020 23:00:00,,Vietnam,01/26/2020 23:00:00,2.0,0.0,0.0
211,01/26/2020 23:00:00,,France,01/26/2020 23:00:00,3.0,0.0,0.0
212,01/26/2020 23:00:00,,Australia,01/26/2020 23:00:00,4.0,0.0,0.0
213,01/26/2020 23:00:00,,Nepal,01/26/2020 23:00:00,1.0,0.0,0.0
214,01/26/2020 23:00:00,,Malaysia,01/26/2020 23:00:00,4.0,0.0,0.0
215,01/26/2020 23:00:00,Ontario,Canada,01/26/2020 23:00:00,1.0,0.0,0.0
216,01/27/2020 20:30:00,Hubei,Mainland China,01/27/2020 20:30:00,2714.0,100.0,47.0
217,01/27/2020 20:30:00,Zhejiang,Mainland China,01/27/2020 20:30:00,173.0,0.0,1.0
218,01/27/2020 20:30:00,Henan,Mainland China,01/27/2020 20:30:00,168.0,1.0,0.0
219,01/27/2020 20:30:00,Guangdong,Mainland China,01/27/2020 20:30:00,151.0,0.0,4.0
220,01/27/2020 20:30:00,Chongqing,Mainland China,01/27/2020 20:30:00,132.0,0.0,0.0
221,01/27/2020 20:30:00,Anhui,Mainland China,01/27/2020 20:30:00,106.0,0.0,0.0
222,01/27/2020 20:30:00,Hunan,Mainland China,01/27/2020 20:30:00,100.0,0.0,0.0
223,01/27/2020 20:30:00,Sichuan,Mainland China,01/27/2020 20:30:00,90.0,0.0,0.0
224,01/27/2020 20:30:00,Shandong,Mainland China,01/27/2020 20:30:00,87.0,1.0,0.0
225,01/27/2020 20:30:00,Beijing,Mainland China,01/27/2020 20:30:00,80.0,1.0,2.0
226,01/27/2020 20:30:00,Jiangxi,Mainland China,01/27/2020 20:30:00,72.0,0.0,2.0
227,01/27/2020 20:30:00,Jiangsu,Mainland China,01/27/2020 20:30:00,70.0,0.0,1.0
228,01/27/2020 20:30:00,Shanghai,Mainland China,01/27/2020 20:30:00,66.0,1.0,3.0
229,01/27/2020 20:30:00,Fujian,Mainland China,01/27/2020 20:30:00,59.0,0.0,0.0
230,01/27/2020 20:30:00,Guangxi,Mainland China,01/27/2020 20:30:00,51.0,0.0,0.0
231,01/27/2020 20:30:00,Shaanxi,Mainland China,01/27/2020 20:30:00,35.0,0.0,0.0
232,01/27/2020 20:30:00,Hainan,Mainland China,01/27/2020 20:30:00,33.0,1.0,0.0
233,01/27/2020 20:30:00,Hebei,Mainland China,01/27/2020 20:30:00,33.0,1.0,0.0
234,01/27/2020 20:30:00,Heilongjiang,Mainland China,01/27/2020 20:30:00,30.0,1.0,0.0
235,01/27/2020 20:30:00,Liaoning,Mainland China,01/27/2020 20:30:00,27.0,0.0,0.0
236,01/27/2020 20:30:00,Yunnan,Mainland China,01/27/2020 20:30:00,26.0,0.0,0.0
237,01/27/2020 20:30:00,Tianjin,Mainland China,01/27/2020 20:30:00,23.0,0.0,0.0
238,01/27/2020 20:30:00,Shanxi,Mainland China,01/27/2020 20:30:00,20.0,0.0,0.0
239,01/27/2020 20:30:00,Gansu,Mainland China,01/27/2020 20:30:00,19.0,0.0,0.0
240,01/27/2020 20:30:00,Inner Mongolia,Mainland China,01/27/2020 20:30:00,11.0,0.0,0.0
241,01/27/2020 20:30:00,Guizhou,Mainland China,01/27/2020 20:30:00,9.0,0.0,0.0
242,01/27/2020 20:30:00,Hong Kong,Hong Kong,01/27/2020 20:30:00,8.0,0.0,0.0
243,01/27/2020 20:30:00,Ningxia,Mainland China,01/27/2020 20:30:00,7.0,0.0,0.0
244,01/27/2020 20:30:00,Jilin,Mainland China,01/27/2020 20:30:00,6.0,0.0,0.0
245,01/27/2020 20:30:00,Macau,Macau,01/27/2020 20:30:00,6.0,0.0,0.0
246,01/27/2020 20:30:00,Qinghai,Mainland China,01/27/2020 20:30:00,6.0,0.0,0.0
247,01/27/2020 20:30:00,Taiwan,Taiwan,01/27/2020 20:30:00,5.0,0.0,0.0
248,01/27/2020 20:30:00,Xinjiang,Mainland China,01/27/2020 20:30:00,5.0,0.0,0.0
249,01/27/2020 20:30:00,Washington,US,01/27/2020 20:30:00,1.0,0.0,0.0
250,01/27/2020 20:30:00,Illinois,US,01/27/2020 20:30:00,1.0,0.0,0.0
251,01/27/2020 20:30:00,California,US,01/27/2020 20:30:00,2.0,0.0,0.0
252,01/27/2020 20:30:00,Arizona,US,01/27/2020 20:30:00,1.0,0.0,0.0
253,01/27/2020 20:30:00,,Japan,01/27/2020 20:30:00,4.0,0.0,1.0
254,01/27/2020 20:30:00,,Thailand,01/27/2020 20:30:00,8.0,0.0,2.0
255,01/27/2020 20:30:00,,South Korea,01/27/2020 20:30:00,4.0,0.0,0.0
256,01/27/2020 20:30:00,,Singapore,01/27/2020 20:30:00,5.0,0.0,0.0
257,01/27/2020 20:30:00,,Vietnam,01/27/2020 20:30:00,2.0,0.0,0.0
258,01/27/2020 20:30:00,,France,01/27/2020 20:30:00,3.0,0.0,0.0
259,01/27/2020 20:30:00,,Nepal,01/27/2020 20:30:00,1.0,0.0,0.0
260,01/27/2020 20:30:00,,Malaysia,01/27/2020 20:30:00,4.0,0.0,0.0
261,01/27/2020 20:30:00,Ontario,Canada,01/27/2020 20:30:00,1.0,0.0,0.0
262,01/27/2020 20:30:00,,Cambodia,01/27/2020 20:30:00,1.0,0.0,0.0
263,01/27/2020 20:30:00,,Sri Lanka,01/27/2020 20:30:00,1.0,0.0,0.0
264,01/27/2020 20:30:00,,Ivory Coast,01/27/2020 20:30:00,0.0,0.0,0.0
265,01/27/2020 20:30:00,New South Wales,Australia,01/27/2020 20:30:00,4.0,0.0,0.0
266,01/27/2020 20:30:00,Victoria,Australia,01/27/2020 20:30:00,1.0,0.0,0.0
267,01/27/2020 20:30:00,Bavaria,Germany,01/27/2020 20:30:00,1.0,0.0,0.0
268,01/28/2020 23:00:00,Hubei,Mainland China,01/28/2020 23:00:00,3554.0,125.0,80.0
269,01/28/2020 23:00:00,Zhejiang,Mainland China,01/28/2020 23:00:00,296.0,0.0,3.0
270,01/28/2020 23:00:00,Guangdong,Mainland China,01/28/2020 23:00:00,241.0,0.0,5.0
271,01/28/2020 23:00:00,Hunan,Mainland China,01/28/2020 23:00:00,221.0,0.0,0.0
272,01/28/2020 23:00:00,Henan,Mainland China,01/28/2020 23:00:00,206.0,2.0,1.0
273,01/28/2020 23:00:00,Anhui,Mainland China,01/28/2020 23:00:00,152.0,0.0,0.0
274,01/28/2020 23:00:00,Chongqing,Mainland China,01/28/2020 23:00:00,147.0,0.0,1.0
275,01/28/2020 23:00:00,Shandong,Mainland China,01/28/2020 23:00:00,121.0,0.0,0.0
276,01/28/2020 23:00:00,Jiangxi,Mainland China,01/28/2020 23:00:00,109.0,0.0,3.0
277,01/28/2020 23:00:00,Sichuan,Mainland China,01/28/2020 23:00:00,108.0,0.0,0.0
278,01/28/2020 23:00:00,Jiangsu,Mainland China,01/28/2020 23:00:00,99.0,0.0,1.0
279,01/28/2020 23:00:00,Beijing,Mainland China,01/28/2020 23:00:00,91.0,1.0,4.0
280,01/28/2020 23:00:00,Fujian,Mainland China,01/28/2020 23:00:00,82.0,0.0,0.0
281,01/28/2020 23:00:00,Shanghai,Mainland China,01/28/2020 23:00:00,80.0,1.0,4.0
282,01/28/2020 23:00:00,Guangxi,Mainland China,01/28/2020 23:00:00,58.0,0.0,2.0
283,01/28/2020 23:00:00,Shaanxi,Mainland China,01/28/2020 23:00:00,56.0,0.0,0.0
284,01/28/2020 23:00:00,Hebei,Mainland China,01/28/2020 23:00:00,48.0,1.0,0.0
285,01/28/2020 23:00:00,Yunnan,Mainland China,01/28/2020 23:00:00,44.0,0.0,0.0
286,01/28/2020 23:00:00,Hainan,Mainland China,01/28/2020 23:00:00,43.0,1.0,0.0
287,01/28/2020 23:00:00,Heilongjiang,Mainland China,01/28/2020 23:00:00,37.0,1.0,0.0
288,01/28/2020 23:00:00,Liaoning,Mainland China,01/28/2020 23:00:00,36.0,0.0,0.0
289,01/28/2020 23:00:00,Shanxi,Mainland China,01/28/2020 23:00:00,27.0,0.0,0.0
290,01/28/2020 23:00:00,Tianjin,Mainland China,01/28/2020 23:00:00,25.0,0.0,0.0
291,01/28/2020 23:00:00,Gansu,Mainland China,01/28/2020 23:00:00,24.0,0.0,0.0
292,01/28/2020 23:00:00,Inner Mongolia,Mainland China,01/28/2020 23:00:00,16.0,0.0,0.0
293,01/28/2020 23:00:00,Xinjiang,Mainland China,01/28/2020 23:00:00,13.0,0.0,0.0
294,01/28/2020 23:00:00,Ningxia,Mainland China,01/28/2020 23:00:00,12.0,0.0,0.0
295,01/28/2020 23:00:00,Guizhou,Mainland China,01/28/2020 23:00:00,9.0,0.0,0.0
296,01/28/2020 23:00:00,Jilin,Mainland China,01/28/2020 23:00:00,9.0,0.0,0.0
297,01/28/2020 23:00:00,Hong Kong,Hong Kong,01/28/2020 23:00:00,8.0,0.0,0.0
298,01/28/2020 23:00:00,Taiwan,Taiwan,01/28/2020 23:00:00,8.0,0.0,0.0
299,01/28/2020 23:00:00,Macau,Macau,01/28/2020 23:00:00,7.0,0.0,0.0
300,01/28/2020 23:00:00,Qinghai,Mainland China,01/28/2020 23:00:00,6.0,0.0,0.0
301,01/28/2020 23:00:00,Washington,US,01/28/2020 23:00:00,1.0,0.0,0.0
302,01/28/2020 23:00:00,Illinois,US,01/28/2020 23:00:00,1.0,0.0,0.0
303,01/28/2020 23:00:00,California,US,01/28/2020 23:00:00,2.0,0.0,0.0
304,01/28/2020 23:00:00,Arizona,US,01/28/2020 23:00:00,1.0,0.0,0.0
305,01/28/2020 23:00:00,,Japan,01/28/2020 23:00:00,7.0,0.0,1.0
306,01/28/2020 23:00:00,,Thailand,01/28/2020 23:00:00,14.0,0.0,5.0
307,01/28/2020 23:00:00,,South Korea,01/28/2020 23:00:00,4.0,0.0,0.0
308,01/28/2020 23:00:00,,Singapore,01/28/2020 23:00:00,7.0,0.0,0.0
309,01/28/2020 23:00:00,,Vietnam,01/28/2020 23:00:00,2.0,0.0,0.0
310,01/28/2020 23:00:00,,France,01/28/2020 23:00:00,4.0,0.0,0.0
311,01/28/2020 23:00:00,,Nepal,01/28/2020 23:00:00,1.0,0.0,0.0
312,01/28/2020 23:00:00,,Malaysia,01/28/2020 23:00:00,7.0,0.0,0.0
313,01/28/2020 23:00:00,Ontario,Canada,01/28/2020 23:00:00,1.0,0.0,0.0
314,01/28/2020 23:00:00,British Columbia,Canada,01/28/2020 23:00:00,1.0,0.0,0.0
315,01/28/2020 23:00:00,,Cambodia,01/28/2020 23:00:00,1.0,0.0,0.0
316,01/28/2020 23:00:00,,Sri Lanka,01/28/2020 23:00:00,1.0,0.0,0.0
317,01/28/2020 23:00:00,New South Wales,Australia,01/28/2020 23:00:00,4.0,0.0,0.0
318,01/28/2020 23:00:00,Victoria,Australia,01/28/2020 23:00:00,1.0,0.0,0.0
319,01/28/2020 23:00:00,Bavaria,Germany,01/28/2020 23:00:00,4.0,0.0,0.0
320,01/29/2020 21:00:00,Hubei,Mainland China,01/29/2020 21:00:00,4586.0,162.0,90.0
321,01/29/2020 21:00:00,Zhejiang,Mainland China,01/29/2020 21:00:00,428.0,0.0,4.0
322,01/29/2020 21:00:00,Guangdong,Mainland China,01/29/2020 21:00:00,311.0,0.0,6.0
323,01/29/2020 21:00:00,Henan,Mainland China,01/29/2020 21:00:00,278.0,2.0,2.0
324,01/29/2020 21:00:00,Hunan,Mainland China,01/29/2020 21:00:00,277.0,0.0,0.0
325,01/29/2020 21:00:00,Anhui,Mainland China,01/29/2020 21:00:00,200.0,0.0,2.0
326,01/29/2020 21:00:00,Chongqing,Mainland China,01/29/2020 21:00:00,165.0,0.0,1.0
327,01/29/2020 21:00:00,Jiangxi,Mainland China,01/29/2020 21:00:00,162.0,0.0,4.0
328,01/29/2020 21:00:00,Shandong,Mainland China,01/29/2020 21:00:00,145.0,0.0,1.0
329,01/29/2020 21:00:00,Sichuan,Mainland China,01/29/2020 21:00:00,142.0,1.0,1.0
330,01/29/2020 21:00:00,Jiangsu,Mainland China,01/29/2020 21:00:00,129.0,0.0,1.0
331,01/29/2020 21:00:00,Beijing,Mainland China,01/29/2020 21:00:00,111.0,1.0,4.0
332,01/29/2020 21:00:00,Shanghai,Mainland China,01/29/2020 21:00:00,101.0,1.0,5.0
333,01/29/2020 21:00:00,Fujian,Mainland China,01/29/2020 21:00:00,101.0,0.0,0.0
334,01/29/2020 21:00:00,Guangxi,Mainland China,01/29/2020 21:00:00,78.0,0.0,2.0
335,01/29/2020 21:00:00,Hebei,Mainland China,01/29/2020 21:00:00,65.0,1.0,0.0
336,01/29/2020 21:00:00,Shaanxi,Mainland China,01/29/2020 21:00:00,56.0,0.0,0.0
337,01/29/2020 21:00:00,Yunnan,Mainland China,01/29/2020 21:00:00,55.0,0.0,0.0
338,01/29/2020 21:00:00,Hainan,Mainland China,01/29/2020 21:00:00,43.0,1.0,0.0
339,01/29/2020 21:00:00,Heilongjiang,Mainland China,01/29/2020 21:00:00,43.0,1.0,0.0
340,01/29/2020 21:00:00,Liaoning,Mainland China,01/29/2020 21:00:00,39.0,0.0,1.0
341,01/29/2020 21:00:00,Shanxi,Mainland China,01/29/2020 21:00:00,35.0,0.0,1.0
342,01/29/2020 21:00:00,Tianjin,Mainland China,01/29/2020 21:00:00,27.0,0.0,0.0
343,01/29/2020 21:00:00,Gansu,Mainland China,01/29/2020 21:00:00,26.0,0.0,0.0
344,01/29/2020 21:00:00,Inner Mongolia,Mainland China,01/29/2020 21:00:00,16.0,0.0,0.0
345,01/29/2020 21:00:00,Jilin,Mainland China,01/29/2020 21:00:00,14.0,0.0,1.0
346,01/29/2020 21:00:00,Xinjiang,Mainland China,01/29/2020 21:00:00,14.0,0.0,0.0
347,01/29/2020 21:00:00,Guizhou,Mainland China,01/29/2020 21:00:00,12.0,0.0,1.0
348,01/29/2020 21:00:00,Ningxia,Mainland China,01/29/2020 21:00:00,12.0,0.0,0.0
349,01/29/2020 21:00:00,Hong Kong,Hong Kong,01/29/2020 21:00:00,10.0,0.0,0.0
350,01/29/2020 21:00:00,Taiwan,Taiwan,01/29/2020 21:00:00,8.0,0.0,0.0
351,01/29/2020 21:00:00,Macau,Macau,01/29/2020 21:00:00,7.0,0.0,0.0
352,01/29/2020 21:00:00,Qinghai,Mainland China,01/29/2020 21:00:00,6.0,0.0,0.0
353,01/29/2020 21:00:00,Tibet,Mainland China,01/29/2020 21:00:00,1.0,0.0,0.0
354,01/29/2020 21:00:00,Washington,US,01/29/2020 21:00:00,1.0,0.0,0.0
355,01/29/2020 21:00:00,Illinois,US,01/29/2020 21:00:00,1.0,0.0,0.0
356,01/29/2020 21:00:00,California,US,01/29/2020 21:00:00,2.0,0.0,0.0
357,01/29/2020 21:00:00,Arizona,US,01/29/2020 21:00:00,1.0,0.0,0.0
358,01/29/2020 21:00:00,,Japan,01/29/2020 21:00:00,11.0,0.0,1.0
359,01/29/2020 21:00:00,,Thailand,01/29/2020 21:00:00,14.0,0.0,5.0
360,01/29/2020 21:00:00,,South Korea,01/29/2020 21:00:00,4.0,0.0,0.0
361,01/29/2020 21:00:00,,Singapore,01/29/2020 21:00:00,10.0,0.0,0.0
362,01/29/2020 21:00:00,,Vietnam,01/29/2020 21:00:00,2.0,0.0,0.0
363,01/29/2020 21:00:00,,France,01/29/2020 21:00:00,5.0,0.0,0.0
364,01/29/2020 21:00:00,,Nepal,01/29/2020 21:00:00,1.0,0.0,0.0
365,01/29/2020 21:00:00,,Malaysia,01/29/2020 21:00:00,7.0,0.0,0.0
366,01/29/2020 21:00:00,Ontario,Canada,01/29/2020 21:00:00,2.0,0.0,0.0
367,01/29/2020 21:00:00,British Columbia,Canada,01/29/2020 21:00:00,1.0,0.0,0.0
368,01/29/2020 21:00:00,,Cambodia,01/29/2020 21:00:00,1.0,0.0,0.0
369,01/29/2020 21:00:00,,Sri Lanka,01/29/2020 21:00:00,1.0,0.0,0.0
370,01/29/2020 21:00:00,New South Wales,Australia,01/29/2020 21:00:00,4.0,0.0,0.0
371,01/29/2020 21:00:00,Victoria,Australia,01/29/2020 21:00:00,2.0,0.0,0.0
372,01/29/2020 21:00:00,Queensland,Australia,01/29/2020 21:00:00,1.0,0.0,0.0
373,01/29/2020 21:00:00,Bavaria,Germany,01/29/2020 21:00:00,4.0,0.0,0.0
374,01/29/2020 21:00:00,,Finland,01/29/2020 21:00:00,1.0,0.0,0.0
375,01/29/2020 21:00:00,,United Arab Emirates,01/29/2020 21:00:00,4.0,0.0,0.0
376,01/30/2020 21:30:00,Hubei,Mainland China,01/30/2020 21:30:00,5806.0,204.0,116.0
377,01/30/2020 21:30:00,Zhejiang,Mainland China,01/30/2020 21:30:00,537.0,0.0,9.0
378,01/30/2020 21:30:00,Guangdong,Mainland China,01/30/2020 21:30:00,393.0,0.0,11.0
379,01/30/2020 21:30:00,Henan,Mainland China,01/30/2020 21:30:00,352.0,2.0,3.0
380,01/30/2020 21:30:00,Hunan,Mainland China,01/30/2020 21:30:00,332.0,0.0,2.0
381,01/30/2020 21:30:00,Jiangxi,Mainland China,01/30/2020 21:30:00,240.0,0.0,7.0
382,01/30/2020 21:30:00,Anhui,Mainland China,01/30/2020 21:30:00,237.0,0.0,3.0
383,01/30/2020 21:30:00,Chongqing,Mainland China,01/30/2020 21:30:00,206.0,0.0,1.0
384,01/30/2020 21:30:00,Shandong,Mainland China,01/30/2020 21:30:00,178.0,0.0,2.0
385,01/30/2020 21:30:00,Sichuan,Mainland China,01/30/2020 21:30:00,177.0,1.0,1.0
386,01/30/2020 21:30:00,Jiangsu,Mainland China,01/30/2020 21:30:00,168.0,0.0,2.0
387,01/30/2020 21:30:00,Shanghai,Mainland China,01/30/2020 21:30:00,128.0,1.0,9.0
388,01/30/2020 21:30:00,Beijing,Mainland China,01/30/2020 21:30:00,121.0,1.0,5.0
389,01/30/2020 21:30:00,Fujian,Mainland China,01/30/2020 21:30:00,101.0,0.0,0.0
390,01/30/2020 21:30:00,Guangxi,Mainland China,01/30/2020 21:30:00,87.0,0.0,2.0
391,01/30/2020 21:30:00,Hebei,Mainland China,01/30/2020 21:30:00,82.0,1.0,0.0
392,01/30/2020 21:30:00,Yunnan,Mainland China,01/30/2020 21:30:00,76.0,0.0,0.0
393,01/30/2020 21:30:00,Shaanxi,Mainland China,01/30/2020 21:30:00,87.0,0.0,0.0
394,01/30/2020 21:30:00,Heilongjiang,Mainland China,01/30/2020 21:30:00,59.0,2.0,0.0
395,01/30/2020 21:30:00,Hainan,Mainland China,01/30/2020 21:30:00,50.0,1.0,1.0
396,01/30/2020 21:30:00,Liaoning,Mainland China,01/30/2020 21:30:00,45.0,0.0,1.0
397,01/30/2020 21:30:00,Shanxi,Mainland China,01/30/2020 21:30:00,39.0,0.0,1.0
398,01/30/2020 21:30:00,Tianjin,Mainland China,01/30/2020 21:30:00,32.0,0.0,0.0
399,01/30/2020 21:30:00,Gansu,Mainland China,01/30/2020 21:30:00,29.0,0.0,0.0
400,01/30/2020 21:30:00,Ningxia,Mainland China,01/30/2020 21:30:00,21.0,0.0,1.0
401,01/30/2020 21:30:00,Inner Mongolia,Mainland China,01/30/2020 21:30:00,20.0,0.0,0.0
402,01/30/2020 21:30:00,Xinjiang,Mainland China,01/30/2020 21:30:00,17.0,0.0,0.0
403,01/30/2020 21:30:00,Guizhou,Mainland China,01/30/2020 21:30:00,15.0,0.0,1.0
404,01/30/2020 21:30:00,Jilin,Mainland China,01/30/2020 21:30:00,14.0,0.0,1.0
405,01/30/2020 21:30:00,Hong Kong,Hong Kong,01/30/2020 21:30:00,12.0,0.0,0.0
406,01/30/2020 21:30:00,Taiwan,Taiwan,01/30/2020 21:30:00,9.0,0.0,0.0
407,01/30/2020 21:30:00,Qinghai,Mainland China,01/30/2020 21:30:00,8.0,0.0,0.0
408,01/30/2020 21:30:00,Macau,Macau,01/30/2020 21:30:00,7.0,0.0,0.0
409,01/30/2020 21:30:00,Tibet,Mainland China,01/30/2020 21:30:00,1.0,0.0,0.0
410,01/30/2020 21:30:00,Washington,US,01/30/2020 21:30:00,1.0,0.0,0.0
411,01/30/2020 21:30:00,Illinois,US,01/30/2020 21:30:00,2.0,0.0,0.0
412,01/30/2020 21:30:00,California,US,01/30/2020 21:30:00,2.0,0.0,0.0
413,01/30/2020 21:30:00,Arizona,US,01/30/2020 21:30:00,1.0,0.0,0.0
414,01/30/2020 21:30:00,,Japan,01/30/2020 21:30:00,11.0,0.0,1.0
415,01/30/2020 21:30:00,,Thailand,01/30/2020 21:30:00,14.0,0.0,5.0
416,01/30/2020 21:30:00,,South Korea,01/30/2020 21:30:00,6.0,0.0,0.0
417,01/30/2020 21:30:00,,Singapore,01/30/2020 21:30:00,10.0,0.0,0.0
418,01/30/2020 21:30:00,,Vietnam,01/30/2020 21:30:00,2.0,0.0,0.0
419,01/30/2020 21:30:00,,France,01/30/2020 21:30:00,5.0,0.0,0.0
420,01/30/2020 21:30:00,,Nepal,01/30/2020 21:30:00,1.0,0.0,0.0
421,01/30/2020 21:30:00,,Malaysia,01/30/2020 21:30:00,8.0,0.0,0.0
422,01/30/2020 21:30:00,Ontario,Canada,01/30/2020 21:30:00,2.0,0.0,0.0
423,01/30/2020 21:30:00,British Columbia,Canada,01/30/2020 21:30:00,1.0,0.0,0.0
424,01/30/2020 21:30:00,,Cambodia,01/30/2020 21:30:00,1.0,0.0,0.0
425,01/30/2020 21:30:00,,Sri Lanka,01/30/2020 21:30:00,1.0,0.0,0.0
426,01/30/2020 21:30:00,New South Wales,Australia,01/30/2020 21:30:00,4.0,0.0,2.0
427,01/30/2020 21:30:00,Victoria,Australia,01/30/2020 21:30:00,2.0,0.0,0.0
428,01/30/2020 21:30:00,Queensland,Australia,01/30/2020 21:30:00,3.0,0.0,0.0
429,01/30/2020 21:30:00,Bavaria,Germany,01/30/2020 21:30:00,4.0,0.0,0.0
430,01/30/2020 21:30:00,,Finland,01/30/2020 21:30:00,1.0,0.0,0.0
431,01/30/2020 21:30:00,,United Arab Emirates,01/30/2020 21:30:00,4.0,0.0,0.0
432,01/30/2020 21:30:00,,Philippines,01/30/2020 21:30:00,1.0,0.0,0.0
433,01/30/2020 21:30:00,,India,01/30/2020 21:30:00,1.0,0.0,0.0
434,01/30/2020 21:30:00,,Italy,01/30/2020 21:30:00,2.0,0.0,0.0
435,01/31/2020 19:00:00,Hubei,Mainland China,01/31/2020 19:00:00,7153.0,249.0,169.0
436,01/31/2020 19:00:00,Zhejiang,Mainland China,01/31/2020 19:00:00,537.0,0.0,14.0
437,01/31/2020 19:00:00,Guangdong,Mainland China,01/31/2020 19:00:00,436.0,0.0,10.0
438,01/31/2020 19:00:00,Henan,Mainland China,01/31/2020 19:00:00,352.0,2.0,3.0
439,01/31/2020 19:00:00,Hunan,Mainland China,01/31/2020 19:00:00,332.0,0.0,3.0
440,01/31/2020 19:00:00,Jiangxi,Mainland China,01/31/2020 19:00:00,240.0,0.0,7.0
441,01/31/2020 19:00:00,Chongqing,Mainland China,01/31/2020 19:00:00,238.0,1.0,1.0
442,01/31/2020 19:00:00,Anhui,Mainland China,01/31/2020 19:00:00,237.0,0.0,3.0
443,01/31/2020 19:00:00,Shandong,Mainland China,01/31/2020 19:00:00,184.0,0.0,2.0
444,01/31/2020 19:00:00,Sichuan,Mainland China,01/31/2020 19:00:00,177.0,1.0,1.0
445,01/31/2020 19:00:00,Jiangsu,Mainland China,01/31/2020 19:00:00,168.0,0.0,5.0
446,01/31/2020 19:00:00,Shanghai,Mainland China,01/31/2020 19:00:00,153.0,1.0,9.0
447,01/31/2020 19:00:00,Beijing,Mainland China,01/31/2020 19:00:00,139.0,1.0,5.0
448,01/31/2020 19:00:00,Fujian,Mainland China,01/31/2020 19:00:00,120.0,0.0,0.0
449,01/31/2020 19:00:00,Hebei,Mainland China,01/31/2020 19:00:00,96.0,1.0,0.0
450,01/31/2020 19:00:00,Guangxi,Mainland China,01/31/2020 19:00:00,88.0,0.0,2.0
451,01/31/2020 19:00:00,Shaanxi,Mainland China,01/31/2020 19:00:00,87.0,0.0,0.0
452,01/31/2020 19:00:00,Yunnan,Mainland China,01/31/2020 19:00:00,83.0,0.0,1.0
453,01/31/2020 19:00:00,Liaoning,Mainland China,01/31/2020 19:00:00,60.0,0.0,1.0
454,01/31/2020 19:00:00,Heilongjiang,Mainland China,01/31/2020 19:00:00,59.0,2.0,0.0
455,01/31/2020 19:00:00,Hainan,Mainland China,01/31/2020 19:00:00,58.0,1.0,1.0
456,01/31/2020 19:00:00,Shanxi,Mainland China,01/31/2020 19:00:00,47.0,0.0,1.0
457,01/31/2020 19:00:00,Gansu,Mainland China,01/31/2020 19:00:00,35.0,0.0,0.0
458,01/31/2020 19:00:00,Tianjin,Mainland China,01/31/2020 19:00:00,32.0,0.0,0.0
459,01/31/2020 19:00:00,Guizhou,Mainland China,01/31/2020 19:00:00,29.0,0.0,2.0
460,01/31/2020 19:00:00,Ningxia,Mainland China,01/31/2020 19:00:00,21.0,0.0,1.0
461,01/31/2020 19:00:00,Inner Mongolia,Mainland China,01/31/2020 19:00:00,20.0,0.0,0.0
462,01/31/2020 19:00:00,Xinjiang,Mainland China,01/31/2020 19:00:00,17.0,0.0,0.0
463,01/31/2020 19:00:00,Jilin,Mainland China,01/31/2020 19:00:00,14.0,0.0,1.0
464,01/31/2020 19:00:00,Hong Kong,Hong Kong,01/31/2020 19:00:00,13.0,0.0,0.0
465,01/31/2020 19:00:00,Taiwan,Taiwan,01/31/2020 19:00:00,10.0,0.0,0.0
466,01/31/2020 19:00:00,Qinghai,Mainland China,01/31/2020 19:00:00,8.0,0.0,0.0
467,01/31/2020 19:00:00,Macau,Macau,01/31/2020 19:00:00,7.0,0.0,0.0
468,01/31/2020 19:00:00,Tibet,Mainland China,01/31/2020 19:00:00,1.0,0.0,0.0
469,01/31/2020 19:00:00,Washington,US,01/31/2020 19:00:00,1.0,0.0,0.0
470,01/31/2020 19:00:00,Illinois,US,01/31/2020 19:00:00,2.0,0.0,0.0
471,01/31/2020 19:00:00,California,US,01/31/2020 19:00:00,3.0,0.0,0.0
472,01/31/2020 19:00:00,Arizona,US,01/31/2020 19:00:00,1.0,0.0,0.0
473,01/31/2020 19:00:00,,Japan,01/31/2020 19:00:00,17.0,0.0,1.0
474,01/31/2020 19:00:00,,Thailand,01/31/2020 19:00:00,19.0,0.0,7.0
475,01/31/2020 19:00:00,,South Korea,01/31/2020 19:00:00,11.0,0.0,0.0
476,01/31/2020 19:00:00,,Singapore,01/31/2020 19:00:00,16.0,0.0,0.0
477,01/31/2020 19:00:00,,Vietnam,01/31/2020 19:00:00,2.0,0.0,0.0
478,01/31/2020 19:00:00,,France,01/31/2020 19:00:00,6.0,0.0,0.0
479,01/31/2020 19:00:00,,Nepal,01/31/2020 19:00:00,1.0,0.0,0.0
480,01/31/2020 19:00:00,,Malaysia,01/31/2020 19:00:00,8.0,0.0,0.0
481,01/31/2020 19:00:00,Ontario,Canada,01/31/2020 19:00:00,2.0,0.0,0.0
482,01/31/2020 19:00:00,British Columbia,Canada,01/31/2020 19:00:00,1.0,0.0,0.0
483,01/31/2020 19:00:00,,Cambodia,01/31/2020 19:00:00,1.0,0.0,0.0
484,01/31/2020 19:00:00,,Sri Lanka,01/31/2020 19:00:00,1.0,0.0,0.0
485,01/31/2020 19:00:00,New South Wales,Australia,01/31/2020 19:00:00,4.0,0.0,2.0
486,01/31/2020 19:00:00,Victoria,Australia,01/31/2020 19:00:00,2.0,0.0,0.0
487,01/31/2020 19:00:00,Queensland,Australia,01/31/2020 19:00:00,3.0,0.0,0.0
488,01/31/2020 19:00:00,Bavaria,Germany,01/31/2020 19:00:00,7.0,0.0,0.0
489,01/31/2020 19:00:00,,Finland,01/31/2020 19:00:00,1.0,0.0,0.0
490,01/31/2020 19:00:00,,United Arab Emirates,01/31/2020 19:00:00,4.0,0.0,0.0
491,01/31/2020 19:00:00,,Philippines,01/31/2020 19:00:00,1.0,0.0,0.0
492,01/31/2020 19:00:00,,India,01/31/2020 19:00:00,1.0,0.0,0.0
493,01/31/2020 19:00:00,,Italy,01/31/2020 19:00:00,2.0,0.0,0.0
494,01/31/2020 19:00:00,,Sweden,01/31/2020 19:00:00,1.0,0.0,0.0
495,01/31/2020 19:00:00,,Russia,01/31/2020 19:00:00,2.0,0.0,0.0
496,01/31/2020 19:00:00,,Spain,01/31/2020 19:00:00,1.0,0.0,0.0
497,01/31/2020 19:00:00,,UK,01/31/2020 19:00:00,2.0,0.0,0.0
498,02/01/2020 23:00:00,Hubei,Mainland China,2020-01-02 23:33:00,9074.0,294.0,215.0
499,02/01/2020 23:00:00,Zhejiang,Mainland China,2020-02-02 02:13:00,661.0,0.0,23.0
500,02/01/2020 23:00:00,Guangdong,Mainland China,2020-02-02 01:23:00,604.0,0.0,14.0
501,02/01/2020 23:00:00,Henan,Mainland China,2020-02-02 00:53:00,493.0,2.0,4.0
502,02/01/2020 23:00:00,Hunan,Mainland China,2020-02-02 01:53:00,463.0,0.0,8.0
503,02/01/2020 23:00:00,Anhui,Mainland China,2020-02-02 01:33:00,340.0,0.0,5.0
504,02/01/2020 23:00:00,Jiangxi,Mainland China,2020-02-02 01:23:00,333.0,0.0,10.0
505,02/01/2020 23:00:00,Chongqing,Mainland China,2020-01-02 23:43:00,262.0,1.0,3.0
506,02/01/2020 23:00:00,Jiangsu,Mainland China,2020-02-02 01:13:00,236.0,0.0,6.0
507,02/01/2020 23:00:00,Sichuan,Mainland China,2020-02-02 01:03:00,231.0,1.0,3.0
508,02/01/2020 23:00:00,Shandong,Mainland China,2020-02-02 01:03:00,225.0,0.0,5.0
509,02/01/2020 23:00:00,Beijing,Mainland China,2020-02-02 03:05:00,183.0,1.0,9.0
510,02/01/2020 23:00:00,Shanghai,Mainland China,2020-02-02 00:23:00,177.0,1.0,10.0
511,02/01/2020 23:00:00,Fujian,Mainland China,2020-02-02 03:43:00,159.0,0.0,0.0
512,02/01/2020 23:00:00,Shaanxi,Mainland China,2020-02-02 03:23:00,116.0,0.0,0.0
513,02/01/2020 23:00:00,Guangxi,Mainland China,2020-02-02 00:23:00,111.0,0.0,2.0
514,02/01/2020 23:00:00,Hebei,Mainland China,2020-02-02 02:53:00,104.0,1.0,3.0
515,02/01/2020 23:00:00,Heilongjiang,Mainland China,2020-02-02 03:23:00,95.0,2.0,2.0
516,02/01/2020 23:00:00,Yunnan,Mainland China,2020-01-02 15:53:00,93.0,0.0,2.0
517,02/01/2020 23:00:00,Liaoning,Mainland China,2020-01-02 15:23:00,64.0,0.0,1.0
518,02/01/2020 23:00:00,Hainan,Mainland China,2020-02-02 01:03:00,63.0,1.0,1.0
519,02/01/2020 23:00:00,Shanxi,Mainland China,2020-01-02 23:33:00,56.0,0.0,1.0
520,02/01/2020 23:00:00,Tianjin,Mainland China,2020-02-02 02:03:00,45.0,0.0,0.0
521,02/01/2020 23:00:00,Gansu,Mainland China,2020-01-02 15:43:00,40.0,0.0,0.0
522,02/01/2020 23:00:00,Guizhou,Mainland China,2020-02-02 01:03:00,38.0,0.0,2.0
523,02/01/2020 23:00:00,Ningxia,Mainland China,2020-02-02 01:43:00,28.0,0.0,0.0
524,02/01/2020 23:00:00,Inner Mongolia,Mainland China,2020-02-02 03:43:00,27.0,0.0,1.0
525,02/01/2020 23:00:00,Jilin,Mainland China,2020-02-02 02:33:00,23.0,0.0,1.0
526,02/01/2020 23:00:00,Xinjiang,Mainland China,2020-02-02 00:43:00,21.0,0.0,0.0
527,02/01/2020 23:00:00,,Japan,2020-01-02 18:53:00,20.0,0.0,1.0
528,02/01/2020 23:00:00,,Thailand,1/31/2020 10:37,19.0,0.0,5.0
529,02/01/2020 23:00:00,,Singapore,2020-02-02 01:03:00,18.0,0.0,0.0
530,02/01/2020 23:00:00,,South Korea,2020-02-02 02:23:00,15.0,0.0,0.0
531,02/01/2020 23:00:00,Hong Kong,Hong Kong,2020-02-02 01:03:00,14.0,0.0,0.0
532,02/01/2020 23:00:00,Taiwan,Taiwan,1/31/2020 15:20,10.0,0.0,0.0
533,02/01/2020 23:00:00,Qinghai,Mainland China,2020-01-02 05:37:00,9.0,0.0,0.0
534,02/01/2020 23:00:00,,Germany,2020-01-02 23:33:00,8.0,0.0,0.0
535,02/01/2020 23:00:00,,Malaysia,1/31/2020 8:15,8.0,0.0,0.0
536,02/01/2020 23:00:00,Macau,Macau,1/31/2020 8:15,7.0,0.0,0.0
537,02/01/2020 23:00:00,,France,2020-01-02 01:52:00,6.0,0.0,0.0
538,02/01/2020 23:00:00,,Vietnam,2020-01-02 07:38:00,6.0,0.0,1.0
539,02/01/2020 23:00:00,New South Wales,Australia,2020-01-02 18:12:00,4.0,0.0,2.0
540,02/01/2020 23:00:00,Victoria,Australia,2020-01-02 18:12:00,4.0,0.0,0.0
541,02/01/2020 23:00:00,,United Arab Emirates,1/31/2020 8:15,4.0,0.0,0.0
542,02/01/2020 23:00:00,Queensland,Australia,2020-01-02 18:12:00,2.0,0.0,0.0
543,02/01/2020 23:00:00,Ontario,Canada,2020-01-02 18:12:00,3.0,0.0,0.0
544,02/01/2020 23:00:00,,Italy,1/31/2020 8:15,2.0,0.0,0.0
545,02/01/2020 23:00:00,,Philippines,2020-02-02 03:33:00,2.0,1.0,0.0
546,02/01/2020 23:00:00,,Russia,1/31/2020 16:13,2.0,0.0,0.0
547,02/01/2020 23:00:00,,UK,2020-01-02 01:52:00,2.0,0.0,0.0
548,02/01/2020 23:00:00,"Chicago, IL",US,2020-01-02 19:43:00,2.0,0.0,0.0
549,02/01/2020 23:00:00,South Australia,Australia,2020-01-02 18:12:00,2.0,0.0,0.0
550,02/01/2020 23:00:00,,Cambodia,1/31/2020 8:15,1.0,0.0,0.0
551,02/01/2020 23:00:00,British Columbia,Canada,2020-01-02 18:12:00,1.0,0.0,0.0
552,02/01/2020 23:00:00,,Finland,1/31/2020 8:15,1.0,0.0,0.0
553,02/01/2020 23:00:00,,India,1/31/2020 8:15,1.0,0.0,0.0
554,02/01/2020 23:00:00,Tibet,Mainland China,2020-01-02 01:52:00,1.0,0.0,0.0
555,02/01/2020 23:00:00,,Nepal,1/31/2020 8:15,1.0,0.0,0.0
556,02/01/2020 23:00:00,,Spain,2020-01-02 23:43:00,1.0,0.0,0.0
557,02/01/2020 23:00:00,,Sri Lanka,1/31/2020 8:15,1.0,0.0,0.0
558,02/01/2020 23:00:00,,Sweden,2020-01-02 02:13:00,1.0,0.0,0.0
559,02/01/2020 23:00:00,"Boston, MA",US,2020-01-02 19:43:00,1.0,0.0,0.0
560,02/01/2020 23:00:00,"Los Angeles, CA",US,2020-01-02 19:53:00,1.0,0.0,0.0
561,02/01/2020 23:00:00,"Orange, CA",US,2020-01-02 19:53:00,1.0,0.0,0.0
562,02/01/2020 23:00:00,"Santa Clara, CA",US,2020-01-02 19:53:00,1.0,0.0,0.0
563,02/01/2020 23:00:00,"Seattle, WA",US,2020-01-02 19:43:00,1.0,0.0,0.0
564,02/01/2020 23:00:00,"Tempe, AZ",US,2020-01-02 19:43:00,1.0,0.0,0.0
565,02/02/2020 21:00:00,Hubei,Mainland China,2020-02-02 23:43:00,11177.0,350.0,295.0
566,02/02/2020 21:00:00,Zhejiang,Mainland China,2020-03-02 01:33:00,724.0,0.0,36.0
567,02/02/2020 21:00:00,Guangdong,Mainland China,2020-03-02 01:33:00,683.0,0.0,15.0
568,02/02/2020 21:00:00,Henan,Mainland China,2020-03-02 01:03:00,566.0,2.0,14.0
569,02/02/2020 21:00:00,Hunan,Mainland China,2020-03-02 01:33:00,521.0,0.0,16.0
570,02/02/2020 21:00:00,Anhui,Mainland China,2020-03-02 00:53:00,408.0,0.0,7.0
571,02/02/2020 21:00:00,Jiangxi,Mainland China,2020-03-02 01:33:00,391.0,0.0,18.0
572,02/02/2020 21:00:00,Chongqing,Mainland China,2020-02-02 23:33:00,300.0,2.0,7.0
573,02/02/2020 21:00:00,Jiangsu,Mainland China,2020-03-02 01:03:00,271.0,0.0,7.0
574,02/02/2020 21:00:00,Sichuan,Mainland China,2020-03-02 01:03:00,254.0,1.0,12.0
575,02/02/2020 21:00:00,Shandong,Mainland China,2020-03-02 01:13:00,246.0,0.0,6.0
576,02/02/2020 21:00:00,Shanghai,Mainland China,2020-03-02 00:03:00,193.0,1.0,10.0
577,02/02/2020 21:00:00,Beijing,Mainland China,2020-02-02 08:43:00,191.0,1.0,9.0
578,02/02/2020 21:00:00,Fujian,Mainland China,2020-02-02 03:43:00,159.0,0.0,0.0
579,02/02/2020 21:00:00,Guangxi,Mainland China,2020-03-02 00:13:00,127.0,0.0,2.0
580,02/02/2020 21:00:00,Shaanxi,Mainland China,2020-02-02 03:23:00,116.0,0.0,0.0
581,02/02/2020 21:00:00,Hebei,Mainland China,2020-03-02 00:23:00,113.0,1.0,3.0
582,02/02/2020 21:00:00,Yunnan,Mainland China,2020-02-02 18:03:00,105.0,0.0,3.0
583,02/02/2020 21:00:00,Heilongjiang,Mainland China,2020-02-02 03:23:00,95.0,2.0,2.0
584,02/02/2020 21:00:00,Hainan,Mainland China,2020-03-02 00:43:00,71.0,1.0,4.0
585,02/02/2020 21:00:00,Liaoning,Mainland China,2020-02-02 18:03:00,70.0,0.0,1.0
586,02/02/2020 21:00:00,Shanxi,Mainland China,2020-02-02 23:23:00,66.0,0.0,3.0
587,02/02/2020 21:00:00,Gansu,Mainland China,2020-02-02 23:43:00,51.0,0.0,3.0
588,02/02/2020 21:00:00,Tianjin,Mainland China,2020-02-02 09:43:00,48.0,0.0,1.0
589,02/02/2020 21:00:00,Guizhou,Mainland China,2020-03-02 01:03:00,46.0,0.0,2.0
590,02/02/2020 21:00:00,Jilin,Mainland China,2020-03-02 00:53:00,31.0,0.0,1.0
591,02/02/2020 21:00:00,Ningxia,Mainland China,2020-02-02 01:43:00,28.0,0.0,0.0
592,02/02/2020 21:00:00,Inner Mongolia,Mainland China,2020-02-02 03:43:00,27.0,0.0,1.0
593,02/02/2020 21:00:00,Xinjiang,Mainland China,2020-03-02 01:13:00,24.0,0.0,0.0
594,02/02/2020 21:00:00,,Japan,2020-01-02 18:53:00,20.0,0.0,1.0
595,02/02/2020 21:00:00,,Thailand,1/31/2020 10:37,19.0,0.0,5.0
596,02/02/2020 21:00:00,,Singapore,2020-02-02 01:03:00,18.0,0.0,0.0
597,02/02/2020 21:00:00,Hong Kong,Hong Kong,2020-02-02 23:53:00,15.0,0.0,0.0
598,02/02/2020 21:00:00,,South Korea,2020-02-02 02:23:00,15.0,0.0,0.0
599,02/02/2020 21:00:00,Qinghai,Mainland China,2020-02-02 05:33:00,11.0,0.0,0.0
600,02/02/2020 21:00:00,,Germany,2020-02-02 18:03:00,10.0,0.0,0.0
601,02/02/2020 21:00:00,Taiwan,Taiwan,1/31/2020 15:20,10.0,0.0,0.0
602,02/02/2020 21:00:00,Macau,Macau,2020-02-02 04:23:00,8.0,0.0,0.0
603,02/02/2020 21:00:00,,Malaysia,1/31/2020 8:15,8.0,0.0,0.0
604,02/02/2020 21:00:00,,France,2020-01-02 01:52:00,6.0,0.0,0.0
605,02/02/2020 21:00:00,,Vietnam,2020-01-02 07:38:00,6.0,0.0,1.0
606,02/02/2020 21:00:00,,United Arab Emirates,2020-02-02 05:43:00,5.0,0.0,0.0
607,02/02/2020 21:00:00,New South Wales,Australia,2020-01-02 18:12:00,4.0,0.0,2.0
608,02/02/2020 21:00:00,Victoria,Australia,2020-01-02 18:12:00,4.0,0.0,0.0
609,02/02/2020 21:00:00,Ontario,Canada,2020-01-02 18:12:00,3.0,0.0,0.0
610,02/02/2020 21:00:00,Queensland,Australia,2020-02-02 22:33:00,2.0,0.0,0.0
611,02/02/2020 21:00:00,South Australia,Australia,2020-02-02 22:33:00,2.0,0.0,0.0
612,02/02/2020 21:00:00,,India,2020-02-02 06:03:00,2.0,0.0,0.0
613,02/02/2020 21:00:00,,Italy,1/31/2020 8:15,2.0,0.0,0.0
614,02/02/2020 21:00:00,,Philippines,2020-02-02 03:33:00,2.0,1.0,0.0
615,02/02/2020 21:00:00,,Russia,1/31/2020 16:13,2.0,0.0,0.0
616,02/02/2020 21:00:00,,UK,2020-01-02 01:52:00,2.0,0.0,0.0
617,02/02/2020 21:00:00,"Chicago, IL",US,2020-01-02 19:43:00,2.0,0.0,0.0
618,02/02/2020 21:00:00,"Santa Clara, CA",US,2020-03-02 00:43:00,2.0,0.0,0.0
619,02/02/2020 21:00:00,,Cambodia,1/31/2020 8:15,1.0,0.0,0.0
620,02/02/2020 21:00:00,British Columbia,Canada,2020-01-02 18:12:00,1.0,0.0,0.0
621,02/02/2020 21:00:00,,Finland,1/31/2020 8:15,1.0,0.0,0.0
622,02/02/2020 21:00:00,Tibet,Mainland China,2020-01-02 01:52:00,1.0,0.0,0.0
623,02/02/2020 21:00:00,,Nepal,1/31/2020 8:15,1.0,0.0,0.0
624,02/02/2020 21:00:00,,Spain,2020-01-02 23:43:00,1.0,0.0,0.0
625,02/02/2020 21:00:00,,Sri Lanka,1/31/2020 8:15,1.0,0.0,0.0
626,02/02/2020 21:00:00,,Sweden,2020-01-02 02:13:00,1.0,0.0,0.0
627,02/02/2020 21:00:00,"Boston, MA",US,2020-01-02 19:43:00,1.0,0.0,0.0
628,02/02/2020 21:00:00,"Los Angeles, CA",US,2020-01-02 19:53:00,1.0,0.0,0.0
629,02/02/2020 21:00:00,"Orange, CA",US,2020-01-02 19:53:00,1.0,0.0,0.0
630,02/02/2020 21:00:00,"Seattle, WA",US,2020-01-02 19:43:00,1.0,0.0,0.0
631,02/02/2020 21:00:00,"Tempe, AZ",US,2020-01-02 19:43:00,1.0,0.0,0.0
632,02/03/2020 21:40:00,Hubei,Mainland China,2020-04-02 01:23:00,13522.0,414.0,396.0
633,02/03/2020 21:40:00,Zhejiang,Mainland China,2020-04-02 01:43:00,829.0,0.0,48.0
634,02/03/2020 21:40:00,Guangdong,Mainland China,2020-04-02 01:43:00,797.0,0.0,21.0
635,02/03/2020 21:40:00,Henan,Mainland China,2020-04-02 01:23:00,675.0,2.0,20.0
636,02/03/2020 21:40:00,Hunan,Mainland China,2020-04-02 01:43:00,593.0,0.0,22.0
637,02/03/2020 21:40:00,Anhui,Mainland China,2020-04-02 00:43:00,480.0,0.0,14.0
638,02/03/2020 21:40:00,Jiangxi,Mainland China,2020-04-02 01:43:00,476.0,0.0,19.0
639,02/03/2020 21:40:00,Chongqing,Mainland China,2020-03-02 23:43:00,337.0,2.0,9.0
640,02/03/2020 21:40:00,Jiangsu,Mainland China,2020-04-02 01:03:00,308.0,0.0,8.0
641,02/03/2020 21:40:00,Sichuan,Mainland China,2020-04-02 01:43:00,282.0,1.0,14.0
642,02/03/2020 21:40:00,Shandong,Mainland China,2020-04-02 00:53:00,270.0,0.0,7.0
643,02/03/2020 21:40:00,Beijing,Mainland China,2020-03-02 09:23:00,212.0,1.0,12.0
644,02/03/2020 21:40:00,Shanghai,Mainland China,2020-04-02 00:13:00,208.0,1.0,10.0
645,02/03/2020 21:40:00,Fujian,Mainland China,2020-03-02 11:33:00,179.0,0.0,1.0
646,02/03/2020 21:40:00,Heilongjiang,Mainland China,2020-04-02 00:53:00,155.0,2.0,2.0
647,02/03/2020 21:40:00,Shaanxi,Mainland China,2020-04-02 02:33:00,142.0,0.0,1.0
648,02/03/2020 21:40:00,Guangxi,Mainland China,2020-04-02 00:33:00,139.0,0.0,7.0
649,02/03/2020 21:40:00,Hebei,Mainland China,2020-04-02 00:23:00,126.0,1.0,3.0
650,02/03/2020 21:40:00,Yunnan,Mainland China,2020-03-02 23:23:00,117.0,0.0,5.0
651,02/03/2020 21:40:00,Hainan,Mainland China,2020-04-02 00:43:00,79.0,1.0,4.0
652,02/03/2020 21:40:00,Liaoning,Mainland China,2020-03-02 17:11:00,74.0,0.0,1.0
653,02/03/2020 21:40:00,Shanxi,Mainland China,2020-03-02 23:13:00,74.0,0.0,2.0
654,02/03/2020 21:40:00,Tianjin,Mainland China,2020-03-02 13:53:00,60.0,0.0,1.0
655,02/03/2020 21:40:00,Guizhou,Mainland China,2020-04-02 01:03:00,56.0,0.0,2.0
656,02/03/2020 21:40:00,Gansu,Mainland China,2020-03-02 23:03:00,55.0,0.0,3.0
657,02/03/2020 21:40:00,Jilin,Mainland China,2020-04-02 00:23:00,42.0,0.0,1.0
658,02/03/2020 21:40:00,Inner Mongolia,Mainland China,2020-03-02 03:03:00,34.0,0.0,1.0
659,02/03/2020 21:40:00,Ningxia,Mainland China,2020-04-02 02:13:00,34.0,0.0,1.0
660,02/03/2020 21:40:00,Xinjiang,Mainland China,2020-04-02 01:33:00,29.0,0.0,0.0
661,02/03/2020 21:40:00,,Japan,2020-01-02 18:53:00,20.0,0.0,1.0
662,02/03/2020 21:40:00,,Thailand,1/31/20 10:37,19.0,0.0,5.0
663,02/03/2020 21:40:00,,Singapore,2020-02-02 01:03:00,18.0,0.0,0.0
664,02/03/2020 21:40:00,Hong Kong,Hong Kong,2020-02-02 23:53:00,15.0,0.0,0.0
665,02/03/2020 21:40:00,Qinghai,Mainland China,2020-04-02 01:33:00,15.0,0.0,0.0
666,02/03/2020 21:40:00,,South Korea,2020-02-02 02:23:00,15.0,0.0,0.0
667,02/03/2020 21:40:00,,Germany,2020-03-02 20:53:00,12.0,0.0,0.0
668,02/03/2020 21:40:00,Taiwan,Taiwan,1/31/20 15:20,10.0,0.0,0.0
669,02/03/2020 21:40:00,Macau,Macau,2020-02-02 04:23:00,8.0,0.0,0.0
670,02/03/2020 21:40:00,,Malaysia,1/31/20 8:15,8.0,0.0,0.0
671,02/03/2020 21:40:00,,Vietnam,2020-03-02 21:43:00,8.0,0.0,1.0
672,02/03/2020 21:40:00,,France,2020-01-02 01:52:00,6.0,0.0,0.0
673,02/03/2020 21:40:00,,United Arab Emirates,2020-02-02 05:43:00,5.0,0.0,0.0
674,02/03/2020 21:40:00,New South Wales,Australia,2020-01-02 18:12:00,4.0,0.0,2.0
675,02/03/2020 21:40:00,Victoria,Australia,2020-01-02 18:12:00,4.0,0.0,0.0
676,02/03/2020 21:40:00,,India,2020-03-02 21:43:00,3.0,0.0,0.0
677,02/03/2020 21:40:00,Queensland,Australia,2020-02-02 22:33:00,2.0,0.0,0.0
678,02/03/2020 21:40:00,South Australia,Australia,2020-02-02 22:33:00,2.0,0.0,0.0
679,02/03/2020 21:40:00,"Toronto, ON",Canada,2020-04-02 00:13:00,2.0,0.0,0.0
680,02/03/2020 21:40:00,,Italy,1/31/20 8:15,2.0,0.0,0.0
681,02/03/2020 21:40:00,,Philippines,2020-02-02 03:33:00,2.0,1.0,0.0
682,02/03/2020 21:40:00,,Russia,1/31/20 16:13,2.0,0.0,0.0
683,02/03/2020 21:40:00,,UK,2020-01-02 01:52:00,2.0,0.0,0.0
684,02/03/2020 21:40:00,"Chicago, IL",US,2020-01-02 19:43:00,2.0,0.0,0.0
685,02/03/2020 21:40:00,"San Benito, CA",US,2020-03-02 03:53:00,2.0,0.0,0.0
686,02/03/2020 21:40:00,"Santa Clara, CA",US,2020-03-02 00:43:00,2.0,0.0,0.0
687,02/03/2020 21:40:00,,Cambodia,1/31/20 8:15,1.0,0.0,0.0
688,02/03/2020 21:40:00,British Columbia,Canada,2020-01-02 18:12:00,1.0,0.0,0.0
689,02/03/2020 21:40:00,"London, ON",Canada,2020-04-02 00:03:00,1.0,0.0,0.0
690,02/03/2020 21:40:00,,Finland,1/31/20 8:15,1.0,0.0,0.0
691,02/03/2020 21:40:00,Tibet,Mainland China,2020-01-02 01:52:00,1.0,0.0,0.0
692,02/03/2020 21:40:00,,Nepal,1/31/20 8:15,1.0,0.0,0.0
693,02/03/2020 21:40:00,,Spain,2020-01-02 23:43:00,1.0,0.0,0.0
694,02/03/2020 21:40:00,,Sri Lanka,1/31/20 8:15,1.0,0.0,0.0
695,02/03/2020 21:40:00,,Sweden,2020-01-02 02:13:00,1.0,0.0,0.0
696,02/03/2020 21:40:00,"Boston, MA",US,2020-01-02 19:43:00,1.0,0.0,0.0
697,02/03/2020 21:40:00,"Los Angeles, CA",US,2020-01-02 19:53:00,1.0,0.0,0.0
698,02/03/2020 21:40:00,"Orange, CA",US,2020-01-02 19:53:00,1.0,0.0,0.0
699,02/03/2020 21:40:00,"Seattle, WA",US,2020-01-02 19:43:00,1.0,0.0,0.0
700,02/03/2020 21:40:00,"Tempe, AZ",US,2020-01-02 19:43:00,1.0,0.0,0.0
701,02/04/2020 22:00:00,Hubei,Mainland China,2020-04-02 23:43:00,16678.0,479.0,522.0
702,02/04/2020 22:00:00,Zhejiang,Mainland China,2020-05-02 01:33:00,895.0,0.0,63.0
703,02/04/2020 22:00:00,Guangdong,Mainland China,2020-05-02 02:03:00,870.0,0.0,32.0
704,02/04/2020 22:00:00,Henan,Mainland China,2020-05-02 01:13:00,764.0,2.0,41.0
705,02/04/2020 22:00:00,Hunan,Mainland China,2020-05-02 01:43:00,661.0,0.0,35.0
706,02/04/2020 22:00:00,Jiangxi,Mainland China,2020-05-02 01:33:00,548.0,0.0,27.0
707,02/04/2020 22:00:00,Anhui,Mainland China,2020-05-02 01:13:00,530.0,0.0,20.0
708,02/04/2020 22:00:00,Chongqing,Mainland China,2020-05-02 00:13:00,366.0,2.0,14.0
709,02/04/2020 22:00:00,Jiangsu,Mainland China,2020-05-02 02:43:00,341.0,0.0,13.0
710,02/04/2020 22:00:00,Sichuan,Mainland China,2020-05-02 00:53:00,301.0,1.0,23.0
711,02/04/2020 22:00:00,Shandong,Mainland China,2020-05-02 01:03:00,298.0,0.0,13.0
712,02/04/2020 22:00:00,Shanghai,Mainland China,2020-05-02 00:23:00,233.0,1.0,12.0
713,02/04/2020 22:00:00,Beijing,Mainland China,2020-04-02 08:33:00,228.0,1.0,23.0
714,02/04/2020 22:00:00,Fujian,Mainland China,2020-04-02 12:13:00,194.0,0.0,3.0
715,02/04/2020 22:00:00,Heilongjiang,Mainland China,2020-05-02 01:23:00,190.0,2.0,4.0
716,02/04/2020 22:00:00,Shaanxi,Mainland China,2020-05-02 02:43:00,165.0,0.0,2.0
717,02/04/2020 22:00:00,Guangxi,Mainland China,2020-05-02 00:43:00,150.0,0.0,10.0
718,02/04/2020 22:00:00,Hebei,Mainland China,2020-05-02 02:53:00,135.0,1.0,4.0
719,02/04/2020 22:00:00,Yunnan,Mainland China,2020-04-02 23:23:00,122.0,0.0,5.0
720,02/04/2020 22:00:00,Hainan,Mainland China,2020-05-02 02:53:00,91.0,1.0,4.0
721,02/04/2020 22:00:00,Liaoning,Mainland China,2020-04-02 14:13:00,81.0,0.0,2.0
722,02/04/2020 22:00:00,Shanxi,Mainland China,2020-04-02 23:23:00,81.0,0.0,4.0
723,02/04/2020 22:00:00,Tianjin,Mainland China,2020-04-02 13:33:00,67.0,0.0,2.0
724,02/04/2020 22:00:00,Guizhou,Mainland China,2020-05-02 01:23:00,64.0,0.0,5.0
725,02/04/2020 22:00:00,Gansu,Mainland China,2020-04-02 15:43:00,57.0,0.0,4.0
726,02/04/2020 22:00:00,Jilin,Mainland China,2020-05-02 00:43:00,54.0,0.0,1.0
727,02/04/2020 22:00:00,Inner Mongolia,Mainland China,2020-05-02 01:53:00,42.0,0.0,1.0
728,02/04/2020 22:00:00,Ningxia,Mainland China,2020-04-02 02:13:00,34.0,0.0,1.0
729,02/04/2020 22:00:00,Xinjiang,Mainland China,2020-05-02 02:03:00,32.0,0.0,0.0
730,02/04/2020 22:00:00,,Thailand,2020-04-02 15:33:00,25.0,0.0,5.0
731,02/04/2020 22:00:00,,Singapore,2020-04-02 15:33:00,24.0,0.0,0.0
732,02/04/2020 22:00:00,,Japan,2020-04-02 16:43:00,22.0,0.0,1.0
733,02/04/2020 22:00:00,Hong Kong,Hong Kong,2020-05-02 02:33:00,18.0,1.0,0.0
734,02/04/2020 22:00:00,Qinghai,Mainland China,2020-05-02 01:23:00,17.0,0.0,0.0
735,02/04/2020 22:00:00,,South Korea,2020-04-02 15:33:00,16.0,0.0,0.0
736,02/04/2020 22:00:00,,Germany,2020-03-02 20:53:00,12.0,0.0,0.0
737,02/04/2020 22:00:00,Taiwan,Taiwan,2020-04-02 14:53:00,11.0,0.0,0.0
738,02/04/2020 22:00:00,Macau,Macau,2020-04-02 04:43:00,10.0,0.0,0.0
739,02/04/2020 22:00:00,,Malaysia,2020-04-02 07:33:00,10.0,0.0,0.0
740,02/04/2020 22:00:00,,Vietnam,2020-03-02 21:43:00,8.0,0.0,1.0
741,02/04/2020 22:00:00,,France,2020-01-02 01:52:00,6.0,0.0,0.0
742,02/04/2020 22:00:00,,United Arab Emirates,2020-02-02 05:43:00,5.0,0.0,0.0
743,02/04/2020 22:00:00,New South Wales,Australia,2020-01-02 18:12:00,4.0,0.0,2.0
744,02/04/2020 22:00:00,Victoria,Australia,2020-01-02 18:12:00,4.0,0.0,0.0
745,02/04/2020 22:00:00,Queensland,Australia,2020-04-02 16:53:00,3.0,0.0,0.0
746,02/04/2020 22:00:00,,India,2020-03-02 21:43:00,3.0,0.0,0.0
747,02/04/2020 22:00:00,South Australia,Australia,2020-02-02 22:33:00,2.0,0.0,0.0
748,02/04/2020 22:00:00,"Toronto, ON",Canada,2020-04-02 00:13:00,2.0,0.0,0.0
749,02/04/2020 22:00:00,,Italy,1/31/20 8:15,2.0,0.0,0.0
750,02/04/2020 22:00:00,,Philippines,2020-02-02 03:33:00,2.0,1.0,0.0
751,02/04/2020 22:00:00,,Russia,1/31/20 16:13,2.0,0.0,0.0
752,02/04/2020 22:00:00,,UK,2020-01-02 01:52:00,2.0,0.0,0.0
753,02/04/2020 22:00:00,"Chicago, IL",US,2020-01-02 19:43:00,2.0,0.0,0.0
754,02/04/2020 22:00:00,"San Benito, CA",US,2020-03-02 03:53:00,2.0,0.0,0.0
755,02/04/2020 22:00:00,"Santa Clara, CA",US,2020-03-02 00:43:00,2.0,0.0,0.0
756,02/04/2020 22:00:00,,Belgium,2020-04-02 15:43:00,1.0,0.0,0.0
757,02/04/2020 22:00:00,,Cambodia,1/31/20 8:15,1.0,0.0,0.0
758,02/04/2020 22:00:00,British Columbia,Canada,2020-01-02 18:12:00,1.0,0.0,0.0
759,02/04/2020 22:00:00,"London, ON",Canada,2020-04-02 00:03:00,1.0,0.0,0.0
760,02/04/2020 22:00:00,,Finland,1/31/20 8:15,1.0,0.0,0.0
761,02/04/2020 22:00:00,Tibet,Mainland China,2020-01-02 01:52:00,1.0,0.0,0.0
762,02/04/2020 22:00:00,,Nepal,1/31/20 8:15,1.0,0.0,0.0
763,02/04/2020 22:00:00,,Spain,2020-01-02 23:43:00,1.0,0.0,0.0
764,02/04/2020 22:00:00,,Sri Lanka,1/31/20 8:15,1.0,0.0,0.0
765,02/04/2020 22:00:00,,Sweden,2020-01-02 02:13:00,1.0,0.0,0.0
766,02/04/2020 22:00:00,"Boston, MA",US,2020-01-02 19:43:00,1.0,0.0,0.0
767,02/04/2020 22:00:00,"Los Angeles, CA",US,2020-01-02 19:53:00,1.0,0.0,0.0
768,02/04/2020 22:00:00,"Orange, CA",US,2020-01-02 19:53:00,1.0,0.0,0.0
769,02/04/2020 22:00:00,"Seattle, WA",US,2020-01-02 19:43:00,1.0,0.0,0.0
770,02/04/2020 22:00:00,"Tempe, AZ",US,2020-01-02 19:43:00,1.0,0.0,0.0
771,02/05/2020 12:20:00,Hubei,Mainland China,2020-05-02 16:43:00,16678.0,479.0,538.0
772,02/05/2020 12:20:00,Guangdong,Mainland China,2020-05-02 13:23:00,895.0,0.0,49.0
773,02/05/2020 12:20:00,Zhejiang,Mainland China,2020-05-02 15:13:00,895.0,0.0,78.0
774,02/05/2020 12:20:00,Henan,Mainland China,2020-05-02 15:03:00,764.0,2.0,47.0
775,02/05/2020 12:20:00,Hunan,Mainland China,2020-05-02 15:23:00,661.0,0.0,54.0
776,02/05/2020 12:20:00,Jiangxi,Mainland China,2020-05-02 01:33:00,548.0,0.0,27.0
777,02/05/2020 12:20:00,Anhui,Mainland China,2020-05-02 13:43:00,530.0,0.0,23.0
778,02/05/2020 12:20:00,Chongqing,Mainland China,2020-05-02 09:13:00,376.0,2.0,15.0
779,02/05/2020 12:20:00,Jiangsu,Mainland China,2020-05-02 12:43:00,341.0,0.0,23.0
780,02/05/2020 12:20:00,Shandong,Mainland China,2020-05-02 10:13:00,307.0,0.0,15.0
781,02/05/2020 12:20:00,Sichuan,Mainland China,2020-05-02 10:13:00,301.0,1.0,24.0
782,02/05/2020 12:20:00,Beijing,Mainland China,2020-05-02 05:43:00,253.0,1.0,24.0
783,02/05/2020 12:20:00,Shanghai,Mainland China,2020-05-02 06:23:00,243.0,1.0,15.0
784,02/05/2020 12:20:00,Fujian,Mainland China,2020-05-02 12:33:00,205.0,0.0,11.0
785,02/05/2020 12:20:00,Heilongjiang,Mainland China,2020-05-02 12:13:00,190.0,2.0,7.0
786,02/05/2020 12:20:00,Shaanxi,Mainland China,2020-05-02 08:43:00,165.0,0.0,6.0
787,02/05/2020 12:20:00,Guangxi,Mainland China,2020-05-02 12:03:00,150.0,0.0,13.0
788,02/05/2020 12:20:00,Hebei,Mainland China,2020-05-02 11:23:00,135.0,1.0,6.0
789,02/05/2020 12:20:00,Yunnan,Mainland China,2020-05-02 07:43:00,124.0,0.0,5.0
790,02/05/2020 12:20:00,Hainan,Mainland China,2020-05-02 16:43:00,99.0,1.0,5.0
791,02/05/2020 12:20:00,Liaoning,Mainland China,2020-05-02 15:23:00,89.0,0.0,4.0
792,02/05/2020 12:20:00,Shanxi,Mainland China,2020-05-02 15:23:00,81.0,0.0,5.0
793,02/05/2020 12:20:00,Tianjin,Mainland China,2020-05-02 03:43:00,69.0,1.0,2.0
794,02/05/2020 12:20:00,Guizhou,Mainland China,2020-05-02 12:33:00,64.0,1.0,9.0
795,02/05/2020 12:20:00,Gansu,Mainland China,2020-05-02 16:23:00,62.0,0.0,6.0
796,02/05/2020 12:20:00,Jilin,Mainland China,2020-05-02 11:03:00,54.0,0.0,2.0
797,02/05/2020 12:20:00,Inner Mongolia,Mainland China,2020-05-02 08:53:00,42.0,0.0,3.0
798,02/05/2020 12:20:00,Ningxia,Mainland China,2020-04-02 02:13:00,34.0,0.0,1.0
799,02/05/2020 12:20:00,Xinjiang,Mainland China,2020-05-02 02:03:00,32.0,0.0,0.0
800,02/05/2020 12:20:00,,Singapore,2020-05-02 16:33:00,28.0,0.0,0.0
801,02/05/2020 12:20:00,,Thailand,2020-04-02 15:33:00,25.0,0.0,5.0
802,02/05/2020 12:20:00,,Japan,2020-04-02 16:43:00,22.0,0.0,1.0
803,02/05/2020 12:20:00,Hong Kong,Hong Kong,2020-05-02 13:13:00,21.0,1.0,0.0
804,02/05/2020 12:20:00,,South Korea,2020-05-02 15:33:00,19.0,0.0,0.0
805,02/05/2020 12:20:00,Qinghai,Mainland China,2020-05-02 03:13:00,17.0,0.0,3.0
806,02/05/2020 12:20:00,,Germany,2020-03-02 20:53:00,12.0,0.0,0.0
807,02/05/2020 12:20:00,,Malaysia,2020-05-02 15:43:00,12.0,0.0,0.0
808,02/05/2020 12:20:00,Taiwan,Taiwan,2020-04-02 14:53:00,11.0,0.0,0.0
809,02/05/2020 12:20:00,Macau,Macau,2020-04-02 04:43:00,10.0,0.0,0.0
810,02/05/2020 12:20:00,,Vietnam,2020-03-02 21:43:00,8.0,0.0,1.0
811,02/05/2020 12:20:00,,France,2020-01-02 01:52:00,6.0,0.0,0.0
812,02/05/2020 12:20:00,,United Arab Emirates,2020-02-02 05:43:00,5.0,0.0,0.0
813,02/05/2020 12:20:00,New South Wales,Australia,2020-01-02 18:12:00,4.0,0.0,2.0
814,02/05/2020 12:20:00,Victoria,Australia,2020-01-02 18:12:00,4.0,0.0,0.0
815,02/05/2020 12:20:00,Queensland,Australia,2020-04-02 16:53:00,3.0,0.0,0.0
816,02/05/2020 12:20:00,,India,2020-03-02 21:43:00,3.0,0.0,0.0
817,02/05/2020 12:20:00,South Australia,Australia,2020-02-02 22:33:00,2.0,0.0,0.0
818,02/05/2020 12:20:00,"Toronto, ON",Canada,2020-04-02 00:13:00,2.0,0.0,0.0
819,02/05/2020 12:20:00,,Italy,1/31/20 8:15,2.0,0.0,0.0
820,02/05/2020 12:20:00,,Philippines,2020-02-02 03:33:00,2.0,1.0,0.0
821,02/05/2020 12:20:00,,Russia,1/31/20 16:13,2.0,0.0,0.0
822,02/05/2020 12:20:00,,UK,2020-01-02 01:52:00,2.0,0.0,0.0
823,02/05/2020 12:20:00,"Chicago, IL",US,2020-01-02 19:43:00,2.0,0.0,0.0
824,02/05/2020 12:20:00,"San Benito, CA",US,2020-03-02 03:53:00,2.0,0.0,0.0
825,02/05/2020 12:20:00,"Santa Clara, CA",US,2020-03-02 00:43:00,2.0,0.0,0.0
826,02/05/2020 12:20:00,,Belgium,2020-04-02 15:43:00,1.0,0.0,0.0
827,02/05/2020 12:20:00,,Cambodia,1/31/20 8:15,1.0,0.0,0.0
828,02/05/2020 12:20:00,British Columbia,Canada,2020-01-02 18:12:00,1.0,0.0,0.0
829,02/05/2020 12:20:00,"London, ON",Canada,2020-04-02 00:03:00,1.0,0.0,0.0
830,02/05/2020 12:20:00,,Finland,1/31/20 8:15,1.0,0.0,0.0
831,02/05/2020 12:20:00,Tibet,Mainland China,2020-01-02 01:52:00,1.0,0.0,0.0
832,02/05/2020 12:20:00,,Nepal,1/31/20 8:15,1.0,0.0,0.0
833,02/05/2020 12:20:00,,Spain,2020-01-02 23:43:00,1.0,0.0,0.0
834,02/05/2020 12:20:00,,Sri Lanka,1/31/20 8:15,1.0,0.0,0.0
835,02/05/2020 12:20:00,,Sweden,2020-01-02 02:13:00,1.0,0.0,0.0
836,02/05/2020 12:20:00,"Boston, MA",US,2020-01-02 19:43:00,1.0,0.0,0.0
837,02/05/2020 12:20:00,"Los Angeles, CA",US,2020-01-02 19:53:00,1.0,0.0,0.0
838,02/05/2020 12:20:00,"Orange, CA",US,2020-01-02 19:53:00,1.0,0.0,0.0
839,02/05/2020 12:20:00,"Seattle, WA",US,2020-01-02 19:43:00,1.0,0.0,0.0
840,02/05/2020 12:20:00,"Tempe, AZ",US,2020-01-02 19:43:00,1.0,0.0,0.0
841,02/06/2020 20:05:00,Hubei,Mainland China,2020-06-02 23:23:00,22112.0,618.0,817.0
842,02/06/2020 20:05:00,Guangdong,Mainland China,2020-06-02 12:43:00,970.0,0.0,69.0
843,02/06/2020 20:05:00,Zhejiang,Mainland China,2020-06-02 10:53:00,954.0,0.0,94.0
844,02/06/2020 20:05:00,Henan,Mainland China,2020-06-02 11:23:00,851.0,2.0,56.0
845,02/06/2020 20:05:00,Hunan,Mainland China,2020-06-02 13:13:00,711.0,0.0,81.0
846,02/06/2020 20:05:00,Jiangxi,Mainland China,2020-06-02 02:33:00,600.0,0.0,37.0
847,02/06/2020 20:05:00,Anhui,Mainland China,2020-06-02 13:33:00,591.0,0.0,34.0
848,02/06/2020 20:05:00,Chongqing,Mainland China,2020-06-02 13:43:00,400.0,2.0,24.0
849,02/06/2020 20:05:00,Jiangsu,Mainland China,2020-06-02 08:03:00,373.0,0.0,34.0
850,02/06/2020 20:05:00,Shandong,Mainland China,2020-06-02 07:53:00,347.0,0.0,27.0
851,02/06/2020 20:05:00,Sichuan,Mainland China,2020-06-02 08:03:00,321.0,1.0,31.0
852,02/06/2020 20:05:00,Beijing,Mainland China,2020-06-02 03:23:00,274.0,1.0,31.0
853,02/06/2020 20:05:00,Shanghai,Mainland China,2020-06-02 06:53:00,257.0,1.0,25.0
854,02/06/2020 20:05:00,Heilongjiang,Mainland China,2020-06-02 08:13:00,227.0,3.0,8.0
855,02/06/2020 20:05:00,Fujian,Mainland China,2020-06-02 11:03:00,215.0,0.0,14.0
856,02/06/2020 20:05:00,Shaanxi,Mainland China,2020-06-02 13:53:00,173.0,0.0,9.0
857,02/06/2020 20:05:00,Guangxi,Mainland China,2020-06-02 04:13:00,168.0,0.0,14.0
858,02/06/2020 20:05:00,Hebei,Mainland China,2020-06-02 13:53:00,157.0,1.0,13.0
859,02/06/2020 20:05:00,Yunnan,Mainland China,2020-06-02 09:43:00,133.0,0.0,7.0
860,02/06/2020 20:05:00,Hainan,Mainland China,2020-06-02 11:13:00,106.0,1.0,8.0
861,02/06/2020 20:05:00,Shanxi,Mainland China,2020-06-02 23:03:00,96.0,0.0,12.0
862,02/06/2020 20:05:00,Liaoning,Mainland China,2020-06-02 14:33:00,94.0,0.0,5.0
863,02/06/2020 20:05:00,Tianjin,Mainland China,2020-06-02 06:23:00,78.0,1.0,2.0
864,02/06/2020 20:05:00,Guizhou,Mainland China,2020-06-02 09:53:00,71.0,1.0,6.0
865,02/06/2020 20:05:00,Gansu,Mainland China,2020-05-02 16:23:00,62.0,0.0,6.0
866,02/06/2020 20:05:00,Jilin,Mainland China,2020-06-02 14:23:00,59.0,0.0,4.0
867,02/06/2020 20:05:00,Inner Mongolia,Mainland China,2020-06-02 02:23:00,46.0,0.0,4.0
868,02/06/2020 20:05:00,,Japan,2020-06-02 02:53:00,45.0,0.0,1.0
869,02/06/2020 20:05:00,Ningxia,Mainland China,2020-06-02 02:13:00,40.0,0.0,1.0
870,02/06/2020 20:05:00,Xinjiang,Mainland China,2020-06-02 01:13:00,36.0,0.0,0.0
871,02/06/2020 20:05:00,,Singapore,2020-05-02 16:33:00,28.0,0.0,0.0
872,02/06/2020 20:05:00,,Thailand,2020-04-02 15:33:00,25.0,0.0,5.0
873,02/06/2020 20:05:00,Hong Kong,Hong Kong,2020-06-02 14:43:00,24.0,1.0,0.0
874,02/06/2020 20:05:00,,South Korea,2020-06-02 02:53:00,23.0,0.0,0.0
875,02/06/2020 20:05:00,Qinghai,Mainland China,2020-06-02 02:13:00,18.0,0.0,3.0
876,02/06/2020 20:05:00,Taiwan,Taiwan,2020-06-02 15:03:00,16.0,0.0,1.0
877,02/06/2020 20:05:00,,Germany,2020-03-02 20:53:00,12.0,0.0,0.0
878,02/06/2020 20:05:00,,Malaysia,2020-05-02 15:43:00,12.0,0.0,0.0
879,02/06/2020 20:05:00,Macau,Macau,2020-06-02 14:23:00,10.0,0.0,1.0
880,02/06/2020 20:05:00,,Vietnam,2020-06-02 01:13:00,10.0,0.0,1.0
881,02/06/2020 20:05:00,,France,2020-01-02 01:52:00,6.0,0.0,0.0
882,02/06/2020 20:05:00,,United Arab Emirates,2020-02-02 05:43:00,5.0,0.0,0.0
883,02/06/2020 20:05:00,New South Wales,Australia,2020-06-02 03:13:00,4.0,0.0,2.0
884,02/06/2020 20:05:00,Queensland,Australia,2020-06-02 02:53:00,4.0,0.0,0.0
885,02/06/2020 20:05:00,Victoria,Australia,2020-01-02 18:12:00,4.0,0.0,0.0
886,02/06/2020 20:05:00,,India,2020-03-02 21:43:00,3.0,0.0,0.0
887,02/06/2020 20:05:00,South Australia,Australia,2020-02-02 22:33:00,2.0,0.0,0.0
888,02/06/2020 20:05:00,British Columbia,Canada,2020-05-02 17:33:00,2.0,0.0,0.0
889,02/06/2020 20:05:00,"Toronto, ON",Canada,2020-04-02 00:13:00,2.0,0.0,0.0
890,02/06/2020 20:05:00,,Italy,1/31/20 8:15,2.0,0.0,0.0
891,02/06/2020 20:05:00,,Philippines,2020-02-02 03:33:00,2.0,1.0,0.0
892,02/06/2020 20:05:00,,Russia,1/31/20 16:13,2.0,0.0,0.0
893,02/06/2020 20:05:00,,UK,2020-01-02 01:52:00,2.0,0.0,0.0
894,02/06/2020 20:05:00,"Chicago, IL",US,2020-01-02 19:43:00,2.0,0.0,0.0
895,02/06/2020 20:05:00,"San Benito, CA",US,2020-03-02 03:53:00,2.0,0.0,0.0
896,02/06/2020 20:05:00,"Santa Clara, CA",US,2020-03-02 00:43:00,2.0,0.0,0.0
897,02/06/2020 20:05:00,,Belgium,2020-04-02 15:43:00,1.0,0.0,0.0
898,02/06/2020 20:05:00,,Cambodia,1/31/20 8:15,1.0,0.0,0.0
899,02/06/2020 20:05:00,"London, ON",Canada,2020-04-02 00:03:00,1.0,0.0,0.0
900,02/06/2020 20:05:00,,Finland,1/31/20 8:15,1.0,0.0,0.0
901,02/06/2020 20:05:00,Tibet,Mainland China,2020-01-02 01:52:00,1.0,0.0,0.0
902,02/06/2020 20:05:00,,Nepal,1/31/20 8:15,1.0,0.0,0.0
903,02/06/2020 20:05:00,,Spain,2020-01-02 23:43:00,1.0,0.0,0.0
904,02/06/2020 20:05:00,,Sri Lanka,1/31/20 8:15,1.0,0.0,0.0
905,02/06/2020 20:05:00,,Sweden,2020-01-02 02:13:00,1.0,0.0,0.0
906,02/06/2020 20:05:00,"Boston, MA",US,2020-01-02 19:43:00,1.0,0.0,0.0
907,02/06/2020 20:05:00,"Los Angeles, CA",US,2020-01-02 19:53:00,1.0,0.0,0.0
908,02/06/2020 20:05:00,"Madison, WI",US,2020-05-02 21:53:00,1.0,0.0,0.0
909,02/06/2020 20:05:00,"Orange, CA",US,2020-01-02 19:53:00,1.0,0.0,0.0
910,02/06/2020 20:05:00,"Seattle, WA",US,2020-01-02 19:43:00,1.0,0.0,0.0
911,02/06/2020 20:05:00,"Tempe, AZ",US,2020-01-02 19:43:00,1.0,0.0,0.0
912,02/07/2020 20:24:00,Hubei,Mainland China,2020-07-02 14:03:00,22112.0,618.0,867.0
913,02/07/2020 20:24:00,Guangdong,Mainland China,2020-07-02 10:13:00,1034.0,1.0,88.0
914,02/07/2020 20:24:00,Zhejiang,Mainland China,2020-07-02 11:33:00,1006.0,0.0,123.0
915,02/07/2020 20:24:00,Henan,Mainland China,2020-07-02 14:03:00,914.0,3.0,86.0
916,02/07/2020 20:24:00,Hunan,Mainland China,2020-07-02 11:33:00,772.0,0.0,112.0
917,02/07/2020 20:24:00,Anhui,Mainland China,2020-07-02 05:13:00,665.0,0.0,47.0
918,02/07/2020 20:24:00,Jiangxi,Mainland China,2020-07-02 01:23:00,661.0,0.0,45.0
919,02/07/2020 20:24:00,Chongqing,Mainland China,2020-07-02 12:03:00,415.0,2.0,31.0
920,02/07/2020 20:24:00,Jiangsu,Mainland China,2020-07-02 14:03:00,408.0,0.0,43.0
921,02/07/2020 20:24:00,Shandong,Mainland China,2020-07-02 11:33:00,386.0,0.0,37.0
922,02/07/2020 20:24:00,Sichuan,Mainland China,2020-07-02 08:23:00,344.0,1.0,42.0
923,02/07/2020 20:24:00,Beijing,Mainland China,2020-07-02 03:23:00,297.0,1.0,33.0
924,02/07/2020 20:24:00,Heilongjiang,Mainland China,2020-07-02 07:43:00,277.0,3.0,12.0
925,02/07/2020 20:24:00,Shanghai,Mainland China,2020-07-02 06:14:00,277.0,1.0,30.0
926,02/07/2020 20:24:00,Fujian,Mainland China,2020-07-02 13:23:00,224.0,0.0,20.0
927,02/07/2020 20:24:00,Shaanxi,Mainland China,2020-07-02 08:23:00,184.0,0.0,17.0
928,02/07/2020 20:24:00,Guangxi,Mainland China,2020-07-02 00:33:00,172.0,0.0,17.0
929,02/07/2020 20:24:00,Hebei,Mainland China,2020-07-02 12:03:00,172.0,1.0,22.0
930,02/07/2020 20:24:00,Yunnan,Mainland China,2020-07-02 23:23:00,138.0,0.0,12.0
931,02/07/2020 20:24:00,Hainan,Mainland China,2020-07-02 12:33:00,117.0,2.0,10.0
932,02/07/2020 20:24:00,Liaoning,Mainland China,2020-07-02 15:33:00,99.0,0.0,7.0
933,02/07/2020 20:24:00,Shanxi,Mainland China,2020-07-02 12:33:00,96.0,0.0,15.0
934,02/07/2020 20:24:00,Guizhou,Mainland China,2020-07-02 11:13:00,81.0,1.0,6.0
935,02/07/2020 20:24:00,Tianjin,Mainland China,2020-07-02 05:43:00,81.0,1.0,2.0
936,02/07/2020 20:24:00,Gansu,Mainland China,2020-07-02 02:33:00,67.0,0.0,9.0
937,02/07/2020 20:24:00,Jilin,Mainland China,2020-07-02 00:43:00,65.0,1.0,4.0
938,02/07/2020 20:24:00,Cruise Ship,Others,2020-07-02 16:33:00,61.0,0.0,0.0
939,02/07/2020 20:24:00,Inner Mongolia,Mainland China,2020-07-02 11:13:00,50.0,0.0,5.0
940,02/07/2020 20:24:00,Ningxia,Mainland China,2020-07-02 11:13:00,43.0,0.0,5.0
941,02/07/2020 20:24:00,Xinjiang,Mainland China,2020-07-02 01:43:00,39.0,0.0,0.0
942,02/07/2020 20:24:00,,Singapore,2020-07-02 03:03:00,30.0,0.0,0.0
943,02/07/2020 20:24:00,Hong Kong,Hong Kong,2020-07-02 11:53:00,25.0,1.0,0.0
944,02/07/2020 20:24:00,,Japan,2020-07-02 04:13:00,25.0,0.0,1.0
945,02/07/2020 20:24:00,,Thailand,2020-04-02 15:33:00,25.0,0.0,5.0
946,02/07/2020 20:24:00,,South Korea,2020-07-02 03:03:00,24.0,0.0,1.0
947,02/07/2020 20:24:00,Qinghai,Mainland China,2020-06-02 02:13:00,18.0,0.0,3.0
948,02/07/2020 20:24:00,Taiwan,Taiwan,2020-06-02 15:03:00,16.0,0.0,1.0
949,02/07/2020 20:24:00,,Germany,2020-07-02 16:33:00,13.0,0.0,0.0
950,02/07/2020 20:24:00,,Malaysia,2020-07-02 09:13:00,12.0,0.0,1.0
951,02/07/2020 20:24:00,Macau,Macau,2020-06-02 14:23:00,10.0,0.0,1.0
952,02/07/2020 20:24:00,,Vietnam,2020-06-02 01:13:00,10.0,0.0,1.0
953,02/07/2020 20:24:00,,France,2020-01-02 01:52:00,6.0,0.0,0.0
954,02/07/2020 20:24:00,Queensland,Australia,2020-07-02 01:03:00,5.0,0.0,0.0
955,02/07/2020 20:24:00,,United Arab Emirates,2020-02-02 05:43:00,5.0,0.0,0.0
956,02/07/2020 20:24:00,New South Wales,Australia,2020-06-02 03:13:00,4.0,0.0,2.0
957,02/07/2020 20:24:00,Victoria,Australia,2020-01-02 18:12:00,4.0,0.0,0.0
958,02/07/2020 20:24:00,British Columbia,Canada,2020-07-02 05:43:00,4.0,0.0,0.0
959,02/07/2020 20:24:00,,India,2020-03-02 21:43:00,3.0,0.0,0.0
960,02/07/2020 20:24:00,,Italy,2020-07-02 17:53:00,3.0,0.0,0.0
961,02/07/2020 20:24:00,,Philippines,2020-07-02 16:43:00,3.0,1.0,0.0
962,02/07/2020 20:24:00,,UK,2020-07-02 18:33:00,3.0,0.0,0.0
963,02/07/2020 20:24:00,South Australia,Australia,2020-02-02 22:33:00,2.0,0.0,0.0
964,02/07/2020 20:24:00,"Toronto, ON",Canada,2020-04-02 00:13:00,2.0,0.0,0.0
965,02/07/2020 20:24:00,,Russia,1/31/20 16:13,2.0,0.0,0.0
966,02/07/2020 20:24:00,"Chicago, IL",US,2020-01-02 19:43:00,2.0,0.0,0.0
967,02/07/2020 20:24:00,"San Benito, CA",US,2020-03-02 03:53:00,2.0,0.0,0.0
968,02/07/2020 20:24:00,"Santa Clara, CA",US,2020-03-02 00:43:00,2.0,0.0,0.0
969,02/07/2020 20:24:00,,Belgium,2020-04-02 15:43:00,1.0,0.0,0.0
970,02/07/2020 20:24:00,,Cambodia,1/31/20 8:15,1.0,0.0,0.0
971,02/07/2020 20:24:00,"London, ON",Canada,2020-04-02 00:03:00,1.0,0.0,0.0
972,02/07/2020 20:24:00,,Finland,1/31/20 8:15,1.0,0.0,0.0
973,02/07/2020 20:24:00,Tibet,Mainland China,2020-01-02 01:52:00,1.0,0.0,0.0
974,02/07/2020 20:24:00,,Nepal,1/31/20 8:15,1.0,0.0,0.0
975,02/07/2020 20:24:00,,Spain,2020-01-02 23:43:00,1.0,0.0,0.0
976,02/07/2020 20:24:00,,Sri Lanka,1/31/20 8:15,1.0,0.0,0.0
977,02/07/2020 20:24:00,,Sweden,2020-01-02 02:13:00,1.0,0.0,0.0
978,02/07/2020 20:24:00,"Boston, MA",US,2020-01-02 19:43:00,1.0,0.0,0.0
979,02/07/2020 20:24:00,"Los Angeles, CA",US,2020-01-02 19:53:00,1.0,0.0,0.0
980,02/07/2020 20:24:00,"Madison, WI",US,2020-05-02 21:53:00,1.0,0.0,0.0
981,02/07/2020 20:24:00,"Orange, CA",US,2020-01-02 19:53:00,1.0,0.0,0.0
982,02/07/2020 20:24:00,"Seattle, WA",US,2020-01-02 19:43:00,1.0,0.0,0.0
983,02/07/2020 20:24:00,"Tempe, AZ",US,2020-01-02 19:43:00,1.0,0.0,0.0
984,02/08/2020 23:04:00,Hubei,Mainland China,2020-09-02 03:03:00,27100.0,780.0,1440.0
985,02/08/2020 23:04:00,Guangdong,Mainland China,2020-09-02 01:53:00,1120.0,1.0,125.0
986,02/08/2020 23:04:00,Zhejiang,Mainland China,2020-09-02 03:03:00,1075.0,0.0,185.0
987,02/08/2020 23:04:00,Henan,Mainland China,2020-09-02 01:13:00,1033.0,6.0,131.0
988,02/08/2020 23:04:00,Hunan,Mainland China,2020-09-02 01:13:00,838.0,1.0,159.0
989,02/08/2020 23:04:00,Anhui,Mainland China,2020-09-02 01:23:00,779.0,1.0,59.0
990,02/08/2020 23:04:00,Jiangxi,Mainland China,2020-09-02 01:23:00,740.0,0.0,72.0
991,02/08/2020 23:04:00,Jiangsu,Mainland China,2020-09-02 03:33:00,468.0,0.0,58.0
992,02/08/2020 23:04:00,Chongqing,Mainland China,2020-09-02 00:43:00,446.0,2.0,39.0
993,02/08/2020 23:04:00,Shandong,Mainland China,2020-09-02 02:13:00,435.0,1.0,50.0
994,02/08/2020 23:04:00,Sichuan,Mainland China,2020-09-02 01:13:00,386.0,1.0,60.0
995,02/08/2020 23:04:00,Beijing,Mainland China,2020-09-02 03:43:00,326.0,2.0,37.0
996,02/08/2020 23:04:00,Heilongjiang,Mainland China,2020-09-02 01:03:00,307.0,6.0,13.0
997,02/08/2020 23:04:00,Shanghai,Mainland China,2020-09-02 01:33:00,292.0,1.0,41.0
998,02/08/2020 23:04:00,Fujian,Mainland China,2020-09-02 03:43:00,250.0,0.0,26.0
999,02/08/2020 23:04:00,Shaanxi,Mainland China,2020-09-02 03:03:00,208.0,0.0,25.0
1000,02/08/2020 23:04:00,Hebei,Mainland China,2020-09-02 01:03:00,206.0,2.0,30.0
1001,02/08/2020 23:04:00,Guangxi,Mainland China,2020-09-02 00:33:00,195.0,1.0,18.0
1002,02/08/2020 23:04:00,Yunnan,Mainland China,2020-09-02 00:13:00,140.0,0.0,17.0
1003,02/08/2020 23:04:00,Hainan,Mainland China,2020-09-02 01:53:00,128.0,2.0,15.0
1004,02/08/2020 23:04:00,Shanxi,Mainland China,2020-08-02 23:53:00,115.0,0.0,21.0
1005,02/08/2020 23:04:00,Liaoning,Mainland China,2020-08-02 11:53:00,105.0,0.0,8.0
1006,02/08/2020 23:04:00,Guizhou,Mainland China,2020-09-02 01:23:00,96.0,1.0,7.0
1007,02/08/2020 23:04:00,Tianjin,Mainland China,2020-09-02 04:03:00,90.0,1.0,4.0
1008,02/08/2020 23:04:00,Gansu,Mainland China,2020-08-02 15:13:00,79.0,1.0,12.0
1009,02/08/2020 23:04:00,Jilin,Mainland China,2020-09-02 00:53:00,78.0,1.0,5.0
1010,02/08/2020 23:04:00,Cruise Ship,Others,2020-07-02 16:33:00,61.0,0.0,0.0
1011,02/08/2020 23:04:00,Inner Mongolia,Mainland China,2020-09-02 02:23:00,54.0,0.0,5.0
1012,02/08/2020 23:04:00,Ningxia,Mainland China,2020-09-02 02:03:00,45.0,0.0,13.0
1013,02/08/2020 23:04:00,Xinjiang,Mainland China,2020-09-02 01:23:00,45.0,0.0,0.0
1014,02/08/2020 23:04:00,,Singapore,2020-09-02 02:43:00,40.0,0.0,2.0
1015,02/08/2020 23:04:00,,Thailand,2020-08-02 12:53:00,32.0,0.0,10.0
1016,02/08/2020 23:04:00,Hong Kong,Hong Kong,2020-08-02 00:03:00,26.0,1.0,0.0
1017,02/08/2020 23:04:00,,Japan,2020-07-02 04:13:00,25.0,0.0,1.0
1018,02/08/2020 23:04:00,,South Korea,2020-09-02 02:33:00,25.0,0.0,3.0
1019,02/08/2020 23:04:00,Qinghai,Mainland China,2020-06-02 02:13:00,18.0,0.0,3.0
1020,02/08/2020 23:04:00,Taiwan,Taiwan,2020-08-02 05:23:00,17.0,0.0,1.0
1021,02/08/2020 23:04:00,,Malaysia,2020-08-02 10:23:00,16.0,0.0,1.0
1022,02/08/2020 23:04:00,,Germany,2020-07-02 16:33:00,13.0,0.0,0.0
1023,02/08/2020 23:04:00,,Vietnam,2020-08-02 07:23:00,13.0,0.0,1.0
1024,02/08/2020 23:04:00,,France,2020-08-02 09:53:00,11.0,0.0,0.0
1025,02/08/2020 23:04:00,Macau,Macau,2020-06-02 14:23:00,10.0,0.0,1.0
1026,02/08/2020 23:04:00,,United Arab Emirates,2020-08-02 07:03:00,7.0,0.0,0.0
1027,02/08/2020 23:04:00,Queensland,Australia,2020-07-02 01:03:00,5.0,0.0,0.0
1028,02/08/2020 23:04:00,New South Wales,Australia,2020-06-02 03:13:00,4.0,0.0,2.0
1029,02/08/2020 23:04:00,Victoria,Australia,2020-01-02 18:12:00,4.0,0.0,0.0
1030,02/08/2020 23:04:00,British Columbia,Canada,2020-07-02 05:43:00,4.0,0.0,0.0
1031,02/08/2020 23:04:00,,India,2020-03-02 21:43:00,3.0,0.0,0.0
1032,02/08/2020 23:04:00,,Italy,2020-07-02 17:53:00,3.0,0.0,0.0
1033,02/08/2020 23:04:00,,Philippines,2020-07-02 16:43:00,3.0,1.0,0.0
1034,02/08/2020 23:04:00,,UK,2020-07-02 18:33:00,3.0,0.0,0.0
1035,02/08/2020 23:04:00,South Australia,Australia,2020-02-02 22:33:00,2.0,0.0,0.0
1036,02/08/2020 23:04:00,"Toronto, ON",Canada,2020-04-02 00:13:00,2.0,0.0,0.0
1037,02/08/2020 23:04:00,,Russia,1/31/20 16:13,2.0,0.0,0.0
1038,02/08/2020 23:04:00,"Chicago, IL",US,2020-01-02 19:43:00,2.0,0.0,0.0
1039,02/08/2020 23:04:00,"San Benito, CA",US,2020-03-02 03:53:00,2.0,0.0,0.0
1040,02/08/2020 23:04:00,"Santa Clara, CA",US,2020-03-02 00:43:00,2.0,0.0,0.0
1041,02/08/2020 23:04:00,,Belgium,2020-04-02 15:43:00,1.0,0.0,0.0
1042,02/08/2020 23:04:00,,Cambodia,1/31/20 8:15,1.0,0.0,0.0
1043,02/08/2020 23:04:00,"London, ON",Canada,2020-04-02 00:03:00,1.0,0.0,0.0
1044,02/08/2020 23:04:00,,Finland,1/31/20 8:15,1.0,0.0,0.0
1045,02/08/2020 23:04:00,Tibet,Mainland China,2020-01-02 01:52:00,1.0,0.0,0.0
1046,02/08/2020 23:04:00,,Nepal,1/31/20 8:15,1.0,0.0,0.0
1047,02/08/2020 23:04:00,,Spain,2020-01-02 23:43:00,1.0,0.0,0.0
1048,02/08/2020 23:04:00,,Sri Lanka,2020-08-02 03:43:00,1.0,0.0,1.0
1049,02/08/2020 23:04:00,,Sweden,2020-01-02 02:13:00,1.0,0.0,0.0
1050,02/08/2020 23:04:00,"Boston, MA",US,2020-01-02 19:43:00,1.0,0.0,0.0
1051,02/08/2020 23:04:00,"Los Angeles, CA",US,2020-01-02 19:53:00,1.0,0.0,0.0
1052,02/08/2020 23:04:00,"Madison, WI",US,2020-05-02 21:53:00,1.0,0.0,0.0
1053,02/08/2020 23:04:00,"Orange, CA",US,2020-01-02 19:53:00,1.0,0.0,0.0
1054,02/08/2020 23:04:00,"Seattle, WA",US,2020-01-02 19:43:00,1.0,0.0,0.0
1055,02/08/2020 23:04:00,"Tempe, AZ",US,2020-01-02 19:43:00,1.0,0.0,0.0
1056,02/09/2020 23:20:00,Hubei,Mainland China,2020-02-09 23:33:02,29631.0,871.0,1795.0
1057,02/09/2020 23:20:00,Guangdong,Mainland China,2020-02-10 03:43:20,1151.0,1.0,147.0
1058,02/09/2020 23:20:00,Zhejiang,Mainland China,2020-02-10 01:13:06,1092.0,0.0,201.0
1059,02/09/2020 23:20:00,Henan,Mainland China,2020-02-10 01:13:06,1073.0,6.0,169.0
1060,02/09/2020 23:20:00,Hunan,Mainland China,2020-02-10 02:13:16,879.0,1.0,186.0
1061,02/09/2020 23:20:00,Anhui,Mainland China,2020-02-10 02:03:12,830.0,3.0,73.0
1062,02/09/2020 23:20:00,Jiangxi,Mainland China,2020-02-10 01:23:04,771.0,1.0,102.0
1063,02/09/2020 23:20:00,Jiangsu,Mainland China,2020-02-10 01:43:02,492.0,0.0,72.0
1064,02/09/2020 23:20:00,Chongqing,Mainland China,2020-02-09 23:53:02,468.0,2.0,51.0
1065,02/09/2020 23:20:00,Shandong,Mainland China,2020-02-10 00:43:02,459.0,1.0,63.0
1066,02/09/2020 23:20:00,Sichuan,Mainland China,2020-02-10 01:03:19,405.0,1.0,76.0
1067,02/09/2020 23:20:00,Beijing,Mainland China,2020-02-10 03:13:08,337.0,2.0,44.0
1068,02/09/2020 23:20:00,Heilongjiang,Mainland China,2020-02-10 00:33:03,331.0,7.0,15.0
1069,02/09/2020 23:20:00,Shanghai,Mainland China,2020-02-10 01:33:13,295.0,1.0,44.0
1070,02/09/2020 23:20:00,Fujian,Mainland China,2020-02-10 01:13:06,261.0,0.0,35.0
1071,02/09/2020 23:20:00,Hebei,Mainland China,2020-02-10 00:23:03,218.0,2.0,35.0
1072,02/09/2020 23:20:00,Shaanxi,Mainland China,2020-02-10 02:23:07,213.0,0.0,26.0
1073,02/09/2020 23:20:00,Guangxi,Mainland China,2020-02-10 02:03:17,210.0,1.0,18.0
1074,02/09/2020 23:20:00,Yunnan,Mainland China,2020-02-09 08:53:02,141.0,0.0,18.0
1075,02/09/2020 23:20:00,Hainan,Mainland China,2020-02-10 00:43:02,136.0,3.0,19.0
1076,02/09/2020 23:20:00,Shanxi,Mainland China,2020-02-09 23:43:02,119.0,0.0,25.0
1077,02/09/2020 23:20:00,Guizhou,Mainland China,2020-02-10 01:33:13,109.0,1.0,7.0
1078,02/09/2020 23:20:00,Liaoning,Mainland China,2020-02-09 12:23:03,107.0,0.0,12.0
1079,02/09/2020 23:20:00,Tianjin,Mainland China,2020-02-10 03:43:20,94.0,1.0,4.0
1080,02/09/2020 23:20:00,Gansu,Mainland China,2020-02-09 23:33:02,83.0,2.0,16.0
1081,02/09/2020 23:20:00,Jilin,Mainland China,2020-02-10 00:33:03,80.0,1.0,12.0
1082,02/09/2020 23:20:00,Diamond Princess cruise ship,Others,2020-02-09 06:13:11,64.0,0.0,0.0
1083,02/09/2020 23:20:00,Inner Mongolia,Mainland China,2020-02-10 02:43:05,58.0,0.0,5.0
1084,02/09/2020 23:20:00,Ningxia,Mainland China,2020-02-10 01:43:02,49.0,0.0,13.0
1085,02/09/2020 23:20:00,Xinjiang,Mainland China,2020-02-10 01:13:06,49.0,0.0,0.0
1086,02/09/2020 23:20:00,,Singapore,2020-02-10 03:03:08,43.0,0.0,2.0
1087,02/09/2020 23:20:00,Hong Kong,Hong Kong,2020-02-10 00:03:31,36.0,1.0,0.0
1088,02/09/2020 23:20:00,,Thailand,2020-02-08 12:53:01,32.0,0.0,10.0
1089,02/09/2020 23:20:00,,South Korea,2020-02-10 03:03:09,27.0,0.0,3.0
1090,02/09/2020 23:20:00,,Japan,2020-02-09 06:13:11,26.0,0.0,1.0
1091,02/09/2020 23:20:00,Qinghai,Mainland China,2020-02-06 02:13:15,18.0,0.0,3.0
1092,02/09/2020 23:20:00,,Malaysia,2020-02-10 03:03:09,18.0,0.0,1.0
1093,02/09/2020 23:20:00,Taiwan,Taiwan,2020-02-09 09:13:11,18.0,0.0,1.0
1094,02/09/2020 23:20:00,,Germany,2020-02-09 06:13:11,14.0,0.0,0.0
1095,02/09/2020 23:20:00,,Vietnam,2020-02-10 03:03:09,14.0,0.0,1.0
1096,02/09/2020 23:20:00,,France,2020-02-08 09:53:01,11.0,0.0,0.0
1097,02/09/2020 23:20:00,Macau,Macau,2020-02-06 14:23:04,10.0,0.0,1.0
1098,02/09/2020 23:20:00,,United Arab Emirates,2020-02-08 07:03:16,7.0,0.0,0.0
1099,02/09/2020 23:20:00,Queensland,Australia,2020-02-09 19:33:02,5.0,0.0,0.0
1100,02/09/2020 23:20:00,New South Wales,Australia,2020-02-06 03:13:22,4.0,0.0,2.0
1101,02/09/2020 23:20:00,Victoria,Australia,2020-02-01 18:12:49,4.0,0.0,0.0
1102,02/09/2020 23:20:00,British Columbia,Canada,2020-02-07 05:43:03,4.0,0.0,0.0
1103,02/09/2020 23:20:00,,India,2020-02-03 21:43:02,3.0,0.0,0.0
1104,02/09/2020 23:20:00,,Italy,2020-02-07 17:53:02,3.0,0.0,0.0
1105,02/09/2020 23:20:00,,Philippines,2020-02-07 16:43:04,3.0,1.0,0.0
1106,02/09/2020 23:20:00,,UK,2020-02-07 18:33:02,3.0,0.0,0.0
1107,02/09/2020 23:20:00,South Australia,Australia,2020-02-02 22:33:07,2.0,0.0,0.0
1108,02/09/2020 23:20:00,"Toronto, ON",Canada,2020-02-04 00:13:06,2.0,0.0,0.0
1109,02/09/2020 23:20:00,,Russia,2020-01-31 16:13:45,2.0,0.0,0.0
1110,02/09/2020 23:20:00,,Spain,2020-02-09 20:33:03,2.0,0.0,0.0
1111,02/09/2020 23:20:00,"Chicago, IL",US,2020-02-09 19:03:03,2.0,0.0,2.0
1112,02/09/2020 23:20:00,"San Benito, CA",US,2020-02-03 03:53:02,2.0,0.0,0.0
1113,02/09/2020 23:20:00,"Santa Clara, CA",US,2020-02-03 00:43:02,2.0,0.0,0.0
1114,02/09/2020 23:20:00,,Belgium,2020-02-04 15:43:02,1.0,0.0,0.0
1115,02/09/2020 23:20:00,,Cambodia,2020-01-31 08:15:53,1.0,0.0,0.0
1116,02/09/2020 23:20:00,"London, ON",Canada,2020-02-04 00:03:11,1.0,0.0,0.0
1117,02/09/2020 23:20:00,,Finland,2020-01-31 08:15:53,1.0,0.0,0.0
1118,02/09/2020 23:20:00,Tibet,Mainland China,2020-02-01 01:52:40,1.0,0.0,0.0
1119,02/09/2020 23:20:00,,Nepal,2020-01-31 08:15:53,1.0,0.0,0.0
1120,02/09/2020 23:20:00,,Sri Lanka,2020-02-08 03:43:03,1.0,0.0,1.0
1121,02/09/2020 23:20:00,,Sweden,2020-02-01 02:13:26,1.0,0.0,0.0
1122,02/09/2020 23:20:00,"Boston, MA",US,2020-02-01 19:43:03,1.0,0.0,0.0
1123,02/09/2020 23:20:00,"Los Angeles, CA",US,2020-02-01 19:53:03,1.0,0.0,0.0
1124,02/09/2020 23:20:00,"Madison, WI",US,2020-02-05 21:53:02,1.0,0.0,0.0
1125,02/09/2020 23:20:00,"Orange, CA",US,2020-02-01 19:53:03,1.0,0.0,0.0
1126,02/09/2020 23:20:00,"Seattle, WA",US,2020-02-09 07:03:04,1.0,0.0,1.0
1127,02/09/2020 23:20:00,"Tempe, AZ",US,2020-02-01 19:43:03,1.0,0.0,0.0
1128,02/10/2020 19:30:00,Hubei,Mainland China,2020-02-10 23:33:02,31728.0,974.0,2222.0
1129,02/10/2020 19:30:00,Guangdong,Mainland China,2020-02-10 13:43:02,1159.0,1.0,167.0
1130,02/10/2020 19:30:00,Zhejiang,Mainland China,2020-02-10 14:13:12,1092.0,0.0,242.0
1131,02/10/2020 19:30:00,Henan,Mainland China,2020-02-10 13:53:02,1073.0,6.0,191.0
1132,02/10/2020 19:30:00,Hunan,Mainland China,2020-02-10 13:53:02,879.0,1.0,208.0
1133,02/10/2020 19:30:00,Anhui,Mainland China,2020-02-10 07:23:04,830.0,3.0,88.0
1134,02/10/2020 19:30:00,Jiangxi,Mainland China,2020-02-10 13:53:02,771.0,1.0,105.0
1135,02/10/2020 19:30:00,Jiangsu,Mainland China,2020-02-10 14:03:05,492.0,0.0,81.0
1136,02/10/2020 19:30:00,Chongqing,Mainland China,2020-02-10 23:43:02,486.0,2.0,66.0
1137,02/10/2020 19:30:00,Shandong,Mainland China,2020-02-10 09:33:02,466.0,1.0,66.0
1138,02/10/2020 19:30:00,Sichuan,Mainland China,2020-02-10 10:03:02,405.0,1.0,80.0
1139,02/10/2020 19:30:00,Beijing,Mainland China,2020-02-10 03:13:08,337.0,2.0,44.0
1140,02/10/2020 19:30:00,Heilongjiang,Mainland China,2020-02-10 07:33:05,331.0,7.0,30.0
1141,02/10/2020 19:30:00,Shanghai,Mainland China,2020-02-10 06:03:13,299.0,1.0,48.0
1142,02/10/2020 19:30:00,Fujian,Mainland China,2020-02-10 14:03:05,261.0,0.0,39.0
1143,02/10/2020 19:30:00,Hebei,Mainland China,2020-02-10 10:03:02,218.0,2.0,41.0
1144,02/10/2020 19:30:00,Shaanxi,Mainland China,2020-02-10 13:23:06,213.0,0.0,30.0
1145,02/10/2020 19:30:00,Guangxi,Mainland China,2020-02-10 14:03:05,210.0,1.0,24.0
1146,02/10/2020 19:30:00,Yunnan,Mainland China,2020-02-10 09:43:02,149.0,0.0,19.0
1147,02/10/2020 19:30:00,Hainan,Mainland China,2020-02-10 09:33:02,138.0,3.0,19.0
1148,02/10/2020 19:30:00,Diamond Princess cruise ship,Others,2020-02-10 16:03:12,135.0,0.0,0.0
1149,02/10/2020 19:30:00,Shanxi,Mainland China,2020-02-09 23:43:02,119.0,0.0,25.0
1150,02/10/2020 19:30:00,Guizhou,Mainland China,2020-02-10 12:33:02,109.0,1.0,10.0
1151,02/10/2020 19:30:00,Liaoning,Mainland China,2020-02-10 14:03:05,108.0,0.0,13.0
1152,02/10/2020 19:30:00,Tianjin,Mainland China,2020-02-10 14:23:08,95.0,1.0,8.0
1153,02/10/2020 19:30:00,Gansu,Mainland China,2020-02-11 00:13:04,86.0,2.0,21.0
1154,02/10/2020 19:30:00,Jilin,Mainland China,2020-02-11 00:23:02,81.0,1.0,13.0
1155,02/10/2020 19:30:00,Inner Mongolia,Mainland China,2020-02-10 02:43:05,58.0,0.0,5.0
1156,02/10/2020 19:30:00,Ningxia,Mainland China,2020-02-10 01:43:02,49.0,0.0,13.0
1157,02/10/2020 19:30:00,Xinjiang,Mainland China,2020-02-10 01:13:06,49.0,0.0,0.0
1158,02/10/2020 19:30:00,,Singapore,2020-02-10 19:03:02,45.0,0.0,2.0
1159,02/10/2020 19:30:00,Hong Kong,Hong Kong,2020-02-10 10:13:06,38.0,1.0,0.0
1160,02/10/2020 19:30:00,,Thailand,2020-02-08 12:53:01,32.0,0.0,10.0
1161,02/10/2020 19:30:00,,South Korea,2020-02-10 03:03:09,27.0,0.0,3.0
1162,02/10/2020 19:30:00,,Japan,2020-02-10 21:33:02,26.0,0.0,4.0
1163,02/10/2020 19:30:00,Qinghai,Mainland China,2020-02-06 02:13:15,18.0,0.0,3.0
1164,02/10/2020 19:30:00,,Malaysia,2020-02-10 03:03:09,18.0,0.0,1.0
1165,02/10/2020 19:30:00,Taiwan,Taiwan,2020-02-09 09:13:11,18.0,0.0,1.0
1166,02/10/2020 19:30:00,,Germany,2020-02-09 06:13:11,14.0,0.0,0.0
1167,02/10/2020 19:30:00,,Vietnam,2020-02-10 03:03:09,14.0,0.0,1.0
1168,02/10/2020 19:30:00,,France,2020-02-08 09:53:01,11.0,0.0,0.0
1169,02/10/2020 19:30:00,Macau,Macau,2020-02-06 14:23:04,10.0,0.0,1.0
1170,02/10/2020 19:30:00,,UK,2020-02-10 19:03:02,8.0,0.0,0.0
1171,02/10/2020 19:30:00,,United Arab Emirates,2020-02-10 23:03:09,8.0,0.0,0.0
1172,02/10/2020 19:30:00,Queensland,Australia,2020-02-09 19:33:02,5.0,0.0,0.0
1173,02/10/2020 19:30:00,New South Wales,Australia,2020-02-06 03:13:22,4.0,0.0,2.0
1174,02/10/2020 19:30:00,Victoria,Australia,2020-02-01 18:12:49,4.0,0.0,0.0
1175,02/10/2020 19:30:00,British Columbia,Canada,2020-02-07 05:43:03,4.0,0.0,0.0
1176,02/10/2020 19:30:00,,India,2020-02-03 21:43:02,3.0,0.0,0.0
1177,02/10/2020 19:30:00,,Italy,2020-02-07 17:53:02,3.0,0.0,0.0
1178,02/10/2020 19:30:00,,Philippines,2020-02-07 16:43:04,3.0,1.0,0.0
1179,02/10/2020 19:30:00,South Australia,Australia,2020-02-02 22:33:07,2.0,0.0,0.0
1180,02/10/2020 19:30:00,"Toronto, ON",Canada,2020-02-04 00:13:06,2.0,0.0,0.0
1181,02/10/2020 19:30:00,,Russia,2020-01-31 16:13:45,2.0,0.0,0.0
1182,02/10/2020 19:30:00,,Spain,2020-02-09 20:33:03,2.0,0.0,0.0
1183,02/10/2020 19:30:00,"Chicago, IL",US,2020-02-09 19:03:03,2.0,0.0,2.0
1184,02/10/2020 19:30:00,"San Benito, CA",US,2020-02-03 03:53:02,2.0,0.0,0.0
1185,02/10/2020 19:30:00,"Santa Clara, CA",US,2020-02-03 00:43:02,2.0,0.0,0.0
1186,02/10/2020 19:30:00,,Belgium,2020-02-04 15:43:02,1.0,0.0,0.0
1187,02/10/2020 19:30:00,,Cambodia,2020-01-31 08:15:53,1.0,0.0,0.0
1188,02/10/2020 19:30:00,"London, ON",Canada,2020-02-04 00:03:11,1.0,0.0,0.0
1189,02/10/2020 19:30:00,,Finland,2020-01-31 08:15:53,1.0,0.0,0.0
1190,02/10/2020 19:30:00,Tibet,Mainland China,2020-02-01 01:52:40,1.0,0.0,0.0
1191,02/10/2020 19:30:00,,Nepal,2020-01-31 08:15:53,1.0,0.0,0.0
1192,02/10/2020 19:30:00,,Sri Lanka,2020-02-08 03:43:03,1.0,0.0,1.0
1193,02/10/2020 19:30:00,,Sweden,2020-02-01 02:13:26,1.0,0.0,0.0
1194,02/10/2020 19:30:00,"Boston, MA",US,2020-02-01 19:43:03,1.0,0.0,0.0
1195,02/10/2020 19:30:00,"Los Angeles, CA",US,2020-02-01 19:53:03,1.0,0.0,0.0
1196,02/10/2020 19:30:00,"Madison, WI",US,2020-02-05 21:53:02,1.0,0.0,0.0
1197,02/10/2020 19:30:00,"Orange, CA",US,2020-02-01 19:53:03,1.0,0.0,0.0
1198,02/10/2020 19:30:00,"Seattle, WA",US,2020-02-09 07:03:04,1.0,0.0,1.0
1199,02/10/2020 19:30:00,"Tempe, AZ",US,2020-02-01 19:43:03,1.0,0.0,0.0
1200,02/11/2020 20:44:00,Hubei,Mainland China,2020-02-11 23:33:02,33366.0,1068.0,2639.0
1201,02/11/2020 20:44:00,Guangdong,Mainland China,2020-02-12 01:23:06,1219.0,1.0,241.0
1202,02/11/2020 20:44:00,Henan,Mainland China,2020-02-12 00:43:02,1135.0,8.0,231.0
1203,02/11/2020 20:44:00,Zhejiang,Mainland China,2020-02-12 01:23:06,1131.0,0.0,279.0
1204,02/11/2020 20:44:00,Hunan,Mainland China,2020-02-12 01:43:02,946.0,2.0,263.0
1205,02/11/2020 20:44:00,Anhui,Mainland China,2020-02-12 01:13:08,889.0,4.0,108.0
1206,02/11/2020 20:44:00,Jiangxi,Mainland China,2020-02-12 01:23:06,844.0,1.0,152.0
1207,02/11/2020 20:44:00,Jiangsu,Mainland China,2020-02-12 01:23:06,543.0,0.0,94.0
1208,02/11/2020 20:44:00,Chongqing,Mainland China,2020-02-11 23:53:02,505.0,3.0,79.0
1209,02/11/2020 20:44:00,Shandong,Mainland China,2020-02-12 01:43:02,497.0,1.0,80.0
1210,02/11/2020 20:44:00,Sichuan,Mainland China,2020-02-12 01:03:05,436.0,1.0,85.0
1211,02/11/2020 20:44:00,Heilongjiang,Mainland China,2020-02-12 00:13:27,378.0,8.0,28.0
1212,02/11/2020 20:44:00,Beijing,Mainland China,2020-02-11 03:03:07,342.0,3.0,48.0
1213,02/11/2020 20:44:00,Shanghai,Mainland China,2020-02-12 00:13:27,306.0,1.0,53.0
1214,02/11/2020 20:44:00,Fujian,Mainland China,2020-02-12 00:53:02,272.0,0.0,46.0
1215,02/11/2020 20:44:00,Hebei,Mainland China,2020-02-12 00:03:12,251.0,2.0,48.0
1216,02/11/2020 20:44:00,Guangxi,Mainland China,2020-02-12 00:33:02,222.0,1.0,31.0
1217,02/11/2020 20:44:00,Shaanxi,Mainland China,2020-02-11 06:03:16,219.0,0.0,32.0
1218,02/11/2020 20:44:00,Yunnan,Mainland China,2020-02-12 01:43:02,154.0,0.0,20.0
1219,02/11/2020 20:44:00,Hainan,Mainland China,2020-02-12 00:33:02,151.0,3.0,20.0
1220,02/11/2020 20:44:00,Diamond Princess cruise ship,Others,2020-02-10 16:03:12,135.0,0.0,0.0
1221,02/11/2020 20:44:00,Guizhou,Mainland China,2020-02-12 01:13:08,131.0,1.0,17.0
1222,02/11/2020 20:44:00,Shanxi,Mainland China,2020-02-11 23:33:02,124.0,0.0,30.0
1223,02/11/2020 20:44:00,Liaoning,Mainland China,2020-02-12 00:43:02,116.0,0.0,19.0
1224,02/11/2020 20:44:00,Tianjin,Mainland China,2020-02-11 23:13:05,106.0,2.0,10.0
1225,02/11/2020 20:44:00,Gansu,Mainland China,2020-02-11 15:23:04,86.0,2.0,24.0
1226,02/11/2020 20:44:00,Jilin,Mainland China,2020-02-12 01:03:05,83.0,1.0,18.0
1227,02/11/2020 20:44:00,Xinjiang,Mainland China,2020-02-12 01:43:02,59.0,0.0,3.0
1228,02/11/2020 20:44:00,Inner Mongolia,Mainland China,2020-02-10 02:43:05,58.0,0.0,5.0
1229,02/11/2020 20:44:00,Ningxia,Mainland China,2020-02-11 10:03:08,53.0,0.0,22.0
1230,02/11/2020 20:44:00,Hong Kong,Hong Kong,2020-02-11 09:43:02,49.0,1.0,0.0
1231,02/11/2020 20:44:00,,Singapore,2020-02-11 16:43:06,47.0,0.0,9.0
1232,02/11/2020 20:44:00,,Thailand,2020-02-11 18:43:04,33.0,0.0,10.0
1233,02/11/2020 20:44:00,,South Korea,2020-02-12 00:03:12,28.0,0.0,4.0
1234,02/11/2020 20:44:00,,Japan,2020-02-11 02:53:02,26.0,0.0,9.0
1235,02/11/2020 20:44:00,Qinghai,Mainland China,2020-02-11 11:23:04,18.0,0.0,5.0
1236,02/11/2020 20:44:00,,Malaysia,2020-02-11 03:13:13,18.0,0.0,3.0
1237,02/11/2020 20:44:00,Taiwan,Taiwan,2020-02-09 09:13:11,18.0,0.0,1.0
1238,02/11/2020 20:44:00,,Germany,2020-02-11 19:33:03,16.0,0.0,0.0
1239,02/11/2020 20:44:00,,Vietnam,2020-02-11 16:43:06,15.0,0.0,6.0
1240,02/11/2020 20:44:00,,France,2020-02-08 09:53:01,11.0,0.0,0.0
1241,02/11/2020 20:44:00,Macau,Macau,2020-02-06 14:23:04,10.0,0.0,1.0
1242,02/11/2020 20:44:00,,UK,2020-02-10 19:03:02,8.0,0.0,0.0
1243,02/11/2020 20:44:00,,United Arab Emirates,2020-02-12 00:33:02,8.0,0.0,1.0
1244,02/11/2020 20:44:00,Queensland,Australia,2020-02-09 19:33:02,5.0,0.0,0.0
1245,02/11/2020 20:44:00,New South Wales,Australia,2020-02-06 03:13:22,4.0,0.0,2.0
1246,02/11/2020 20:44:00,Victoria,Australia,2020-02-01 18:12:49,4.0,0.0,0.0
1247,02/11/2020 20:44:00,British Columbia,Canada,2020-02-07 05:43:03,4.0,0.0,0.0
1248,02/11/2020 20:44:00,,India,2020-02-03 21:43:02,3.0,0.0,0.0
1249,02/11/2020 20:44:00,,Italy,2020-02-07 17:53:02,3.0,0.0,0.0
1250,02/11/2020 20:44:00,,Philippines,2020-02-07 16:43:04,3.0,1.0,0.0
1251,02/11/2020 20:44:00,South Australia,Australia,2020-02-02 22:33:07,2.0,0.0,0.0
1252,02/11/2020 20:44:00,"Toronto, ON",Canada,2020-02-04 00:13:06,2.0,0.0,0.0
1253,02/11/2020 20:44:00,,Russia,2020-01-31 16:13:45,2.0,0.0,0.0
1254,02/11/2020 20:44:00,,Spain,2020-02-09 20:33:03,2.0,0.0,0.0
1255,02/11/2020 20:44:00,"Chicago, IL",US,2020-02-09 19:03:03,2.0,0.0,2.0
1256,02/11/2020 20:44:00,"San Benito, CA",US,2020-02-03 03:53:02,2.0,0.0,0.0
1257,02/11/2020 20:44:00,"Santa Clara, CA",US,2020-02-03 00:43:02,2.0,0.0,0.0
1258,02/11/2020 20:44:00,,Belgium,2020-02-04 15:43:02,1.0,0.0,0.0
1259,02/11/2020 20:44:00,,Cambodia,2020-01-31 08:15:53,1.0,0.0,0.0
1260,02/11/2020 20:44:00,"London, ON",Canada,2020-02-04 00:03:11,1.0,0.0,0.0
1261,02/11/2020 20:44:00,,Finland,2020-02-12 00:03:12,1.0,0.0,1.0
1262,02/11/2020 20:44:00,Tibet,Mainland China,2020-02-01 01:52:40,1.0,0.0,0.0
1263,02/11/2020 20:44:00,,Nepal,2020-01-31 08:15:53,1.0,0.0,0.0
1264,02/11/2020 20:44:00,,Sri Lanka,2020-02-08 03:43:03,1.0,0.0,1.0
1265,02/11/2020 20:44:00,,Sweden,2020-02-01 02:13:26,1.0,0.0,0.0
1266,02/11/2020 20:44:00,"Boston, MA",US,2020-02-01 19:43:03,1.0,0.0,0.0
1267,02/11/2020 20:44:00,"Los Angeles, CA",US,2020-02-01 19:53:03,1.0,0.0,0.0
1268,02/11/2020 20:44:00,"Madison, WI",US,2020-02-05 21:53:02,1.0,0.0,0.0
1269,02/11/2020 20:44:00,"Orange, CA",US,2020-02-01 19:53:03,1.0,0.0,0.0
1270,02/11/2020 20:44:00,"San Diego County, CA",US,2020-02-11 01:23:05,1.0,0.0,0.0
1271,02/11/2020 20:44:00,"Seattle, WA",US,2020-02-09 07:03:04,1.0,0.0,1.0
1272,02/11/2020 20:44:00,"Tempe, AZ",US,2020-02-01 19:43:03,1.0,0.0,0.0
1273,02/12/2020 22:00:00,Hubei,Mainland China,2020-02-13 00:03:05,48206.0,1310.0,3441.0
1274,02/12/2020 22:00:00,Guangdong,Mainland China,2020-02-13 02:13:06,1241.0,2.0,284.0
1275,02/12/2020 22:00:00,Henan,Mainland China,2020-02-13 00:33:01,1169.0,10.0,258.0
1276,02/12/2020 22:00:00,Zhejiang,Mainland China,2020-02-13 01:23:08,1145.0,0.0,327.0
1277,02/12/2020 22:00:00,Hunan,Mainland China,2020-02-13 01:33:02,968.0,2.0,312.0
1278,02/12/2020 22:00:00,Anhui,Mainland China,2020-02-13 01:03:06,910.0,5.0,128.0
1279,02/12/2020 22:00:00,Jiangxi,Mainland China,2020-02-13 01:13:08,872.0,1.0,170.0
1280,02/12/2020 22:00:00,Jiangsu,Mainland China,2020-02-13 00:53:02,570.0,0.0,131.0
1281,02/12/2020 22:00:00,Chongqing,Mainland China,2020-02-12 23:13:08,518.0,3.0,102.0
1282,02/12/2020 22:00:00,Shandong,Mainland China,2020-02-13 01:13:08,506.0,2.0,98.0
1283,02/12/2020 22:00:00,Sichuan,Mainland China,2020-02-13 00:33:01,451.0,1.0,93.0
1284,02/12/2020 22:00:00,Heilongjiang,Mainland China,2020-02-13 00:13:14,395.0,9.0,31.0
1285,02/12/2020 22:00:00,Beijing,Mainland China,2020-02-13 02:33:12,366.0,3.0,68.0
1286,02/12/2020 22:00:00,Shanghai,Mainland China,2020-02-13 00:13:14,313.0,1.0,57.0
1287,02/12/2020 22:00:00,Fujian,Mainland China,2020-02-13 00:43:01,279.0,0.0,54.0
1288,02/12/2020 22:00:00,Hebei,Mainland China,2020-02-13 01:53:02,265.0,3.0,55.0
1289,02/12/2020 22:00:00,Shaanxi,Mainland China,2020-02-13 02:13:06,229.0,0.0,42.0
1290,02/12/2020 22:00:00,Guangxi,Mainland China,2020-02-13 00:23:10,222.0,2.0,33.0
1291,02/12/2020 22:00:00,Diamond Princess cruise ship,Others,2020-02-12 04:23:38,175.0,0.0,0.0
1292,02/12/2020 22:00:00,Hainan,Mainland China,2020-02-12 17:03:03,157.0,4.0,27.0
1293,02/12/2020 22:00:00,Yunnan,Mainland China,2020-02-13 02:53:02,155.0,0.0,23.0
1294,02/12/2020 22:00:00,Guizhou,Mainland China,2020-02-13 01:13:08,135.0,1.0,20.0
1295,02/12/2020 22:00:00,Shanxi,Mainland China,2020-02-12 23:03:02,126.0,0.0,33.0
1296,02/12/2020 22:00:00,Liaoning,Mainland China,2020-02-13 02:23:04,116.0,1.0,21.0
1297,02/12/2020 22:00:00,Tianjin,Mainland China,2020-02-13 02:43:02,113.0,2.0,11.0
1298,02/12/2020 22:00:00,Gansu,Mainland China,2020-02-12 23:23:01,87.0,2.0,31.0
1299,02/12/2020 22:00:00,Jilin,Mainland China,2020-02-13 00:23:10,84.0,1.0,22.0
1300,02/12/2020 22:00:00,Ningxia,Mainland China,2020-02-13 01:23:08,64.0,0.0,24.0
1301,02/12/2020 22:00:00,Xinjiang,Mainland China,2020-02-13 01:23:08,63.0,1.0,3.0
1302,02/12/2020 22:00:00,Inner Mongolia,Mainland China,2020-02-13 01:23:08,61.0,0.0,6.0
1303,02/12/2020 22:00:00,Hong Kong,Hong Kong,2020-02-12 09:53:02,50.0,1.0,1.0
1304,02/12/2020 22:00:00,,Singapore,2020-02-12 19:53:02,50.0,0.0,15.0
1305,02/12/2020 22:00:00,,Thailand,2020-02-11 18:43:04,33.0,0.0,10.0
1306,02/12/2020 22:00:00,,Japan,2020-02-12 02:43:03,28.0,0.0,9.0
1307,02/12/2020 22:00:00,,South Korea,2020-02-12 14:43:03,28.0,0.0,7.0
1308,02/12/2020 22:00:00,Qinghai,Mainland China,2020-02-12 08:03:06,18.0,0.0,9.0
1309,02/12/2020 22:00:00,,Malaysia,2020-02-11 03:13:13,18.0,0.0,3.0
1310,02/12/2020 22:00:00,Taiwan,Taiwan,2020-02-09 09:13:11,18.0,0.0,1.0
1311,02/12/2020 22:00:00,,Germany,2020-02-11 19:33:03,16.0,0.0,0.0
1312,02/12/2020 22:00:00,,Vietnam,2020-02-11 16:43:06,15.0,0.0,6.0
1313,02/12/2020 22:00:00,,France,2020-02-12 18:53:02,11.0,0.0,2.0
1314,02/12/2020 22:00:00,Macau,Macau,2020-02-12 09:53:02,10.0,0.0,2.0
1315,02/12/2020 22:00:00,,UK,2020-02-12 19:03:06,9.0,0.0,1.0
1316,02/12/2020 22:00:00,,United Arab Emirates,2020-02-12 00:33:02,8.0,0.0,1.0
1317,02/12/2020 22:00:00,Queensland,Australia,2020-02-09 19:33:02,5.0,0.0,0.0
1318,02/12/2020 22:00:00,New South Wales,Australia,2020-02-06 03:13:22,4.0,0.0,2.0
1319,02/12/2020 22:00:00,Victoria,Australia,2020-02-01 18:12:49,4.0,0.0,0.0
1320,02/12/2020 22:00:00,British Columbia,Canada,2020-02-07 05:43:03,4.0,0.0,0.0
1321,02/12/2020 22:00:00,,India,2020-02-03 21:43:02,3.0,0.0,0.0
1322,02/12/2020 22:00:00,,Italy,2020-02-07 17:53:02,3.0,0.0,0.0
1323,02/12/2020 22:00:00,,Philippines,2020-02-12 07:43:02,3.0,1.0,1.0
1324,02/12/2020 22:00:00,South Australia,Australia,2020-02-02 22:33:07,2.0,0.0,0.0
1325,02/12/2020 22:00:00,"Toronto, ON",Canada,2020-02-04 00:13:06,2.0,0.0,0.0
1326,02/12/2020 22:00:00,,Russia,2020-02-12 14:43:03,2.0,0.0,2.0
1327,02/12/2020 22:00:00,,Spain,2020-02-09 20:33:03,2.0,0.0,0.0
1328,02/12/2020 22:00:00,"Chicago, IL",US,2020-02-09 19:03:03,2.0,0.0,2.0
